company,source,author,title,description,url,published_at,content
Tesla,TheWrap,Sean Burch,Bluesky Is Becoming ‘Blue Heaven’ for ‘The Resistance’ to Trump and Musk,"The rapidly growing social app has become a virtual safe space for celebs, media pundits, and disaffected X users looking to bash right wingers following the election
The post Bluesky Is Becoming ‘Blue Heaven’ for ‘The Resistance’ to Trump and Musk appeared f…",https://www.thewrap.com/bluesky-the-resistance-musk-trump/,2024-11-19T17:02:33Z,"Bluesky is the digital place to be for anyone who considers themselves a card-carrying member of The Resistance to Donald Trump and/or an Elon Musk hater. Spend five minutes on the app, and that is c… [+3462 chars]"
Tesla,The-sun.com,the us sun,Kardashian first to to receive TESLA bot...,THIS is the eerie moment Kim Kardashian beats her new Tesla robot at rock-paper-scissors and lets it drive her Cybercab. The star is the first to receive Elon Musk’s humanoid bot Optimus. Sur…,https://www.the-sun.com/entertainment/12924428/kim-kardashian-tesla-robot-optimus/,2024-11-19T17:00:03Z,"THIS is the eerie moment Kim Kardashian beats her new Tesla robot at rock-paper-scissors and lets it drive her Cybercab.
The star is the first to receive Elon Musk's humanoid bot Optimus.
Optimus c… [+3648 chars]"
Tesla,Harpers.org,Harper’s Magazine,Weekly Review,"In Tromsø, Norway, fishermen trawling for halibut caught the USS Virginia, a nuclear-powered submarine armed with cruise missiles.
The post Weekly Review appeared first on Harper's Magazine.",https://harpers.org/2024/11/weekly-review-trump-cabinet-tulsi-gabbard-theobros-drug-cartels-shot-puppy-prozac-raw-milk-shatter-proof-nuclear-arsenal-tyson-paul-rigged-cocaine-chocolate/,2024-11-19T16:59:33Z,"Donald Trump made more than two dozen appointments and cabinet nominations, including, for secretary of the interior, North Dakota Governor Doug Burgum, who earlier this year organized a private meet… [+6012 chars]"
Tesla,Business Insider,"ggoodwin@businessinsider.com (Grace Eliza Goodwin,Brent D. Griffiths)",Trump's picks are giving Big Tech plenty of reasons to be nervous,"Donald Trump has surrounded himself with advocates to break up Big Tech like Matt Gaetz and Brendan Carr, but it remains to be seen how far he'll go.",https://www.businessinsider.com/trump-big-tech-agenda-nominees-gaetz-carr-vance-2024-11,2024-11-19T16:57:46Z,"Donald Trump has been selecting a steady stream of loyalists he wants to serve in his second administration. A number of his picks have been harsh critics of the Big Tech industry. 
Trump's choices,… [+5900 chars]"
Tesla,Jalopnik,Bradley Brownell,Seattle's Reddit-Famous Abandoned Cybertruck Is Up For Auction If You Want One That Is More Broken Than Usual,"When Tesla talks about the Cybertruck, it frequently pumps up the massive slab-sided $80,000 monstrosity as the pinnacle of masculinity, toughness and strength. It’s often compared to big overwrought machinery from the annals of science fiction, compared to s…",https://jalopnik.com/seattles-reddit-famous-abandoned-cybertruck-is-up-for-a-1851702797,2024-11-19T16:45:00Z,"When Tesla talks about the Cybertruck, it frequently pumps up the massive slab-sided $80,000 monstrosity as the pinnacle of masculinity, toughness and strength. Its often compared to big overwrought … [+1927 chars]"
Tesla,Business Insider,"insider@insider.com (Geoff Weiss,John L. Dorman)",Trump expected to nominate Howard Lutnick for Commerce secretary: reports,"Howard Lutnick, the CEO of Cantor Fitzgerald, is already serving as the co-chair of President-elect Donald Trump's transition team.",https://www.businessinsider.com/howard-lutnick-commerce-secretary-trump-administration-2024-11,2024-11-19T16:29:09Z,"President-elect Donald Trump is expected to tap billionaire finance executive Howard Lutnick as his next Commerce secretary, according to the Wall Street Journal, CNN, and Axios.
Lutnick, who has se… [+1122 chars]"
Tesla,Quartz India,William Gavin,Elon Musk says the allegations against Trump's AG pick Matt Gaetz are 'worth less than nothing',"Elon Musk on Tuesday went to bat for former Rep. Matt Gaetz, President-elect Donald Trump’s controversial pick for attorney general, slamming allegations against him as “worth less than nothing.”Read more...",https://qz.com/elon-musk-donald-trump-matt-gaetz-allegations-ag-tesla-1851702764,2024-11-19T16:25:00Z,"In This Story
Elon Musk on Tuesday went to bat for former Rep. Matt Gaetz, President-elect Donald Trumps controversial pick for attorney general, slamming allegations against him as worth less than … [+3416 chars]"
Tesla,Popular Science,Mack DeGeurin,‘Everything has a cost:’ High-tech products and the new era of mineral mining,"New iPhones and Teslas come with an insatiable demand for lithium and other 'critical metals.'
The post ‘Everything has a cost:’ High-tech products and the new era of mineral mining appeared first on Popular Science.",https://www.popsci.com/environment/lithium-mining/,2024-11-19T16:24:32Z,"Late last month, the U.S. Bureau of Land Management granted approval for a massive new lithium mine in the Nevada desert, the start of what could foretell a rapid ramp-up of domestic mining for so-ca… [+11162 chars]"
Tesla,Forbes,"Rob Isbitts, Senior Contributor, 
 Rob Isbitts, Senior Contributor
 https://www.forbes.com/sites/robisbitts2/",YieldMax ETFs: What They Are And Are They Safe,"YieldMax ETFs offer high-yield income potential, but are they safe? Here's how they work, benefits, risks and tips for investing in these income-focused ETFs.",https://www.forbes.com/sites/investor-hub/article/yieldmax-etfs-what-they-are-are-they-safe/,2024-11-19T16:22:50Z,"getty
The rapid increase in interest in the stock market since the start of the pandemic has some important by-products. One of those is the rocketing appeal in using options as part of an overall i… [+10504 chars]"
Tesla,New York Post,Diana Glebova,Elon Musk remains bullish over Matt Gaetz AG nomination despite sex trafficking allegations: ‘Our hammer of Justice’,Tesla CEO Elon Musk fired off an optimistic post Tuesday about attorney general pick and former Rep. Matt Gaetz — even as sex trafficking allegations against the ex-Florida Republican have clouded his confirmation fight.,https://nypost.com/2024/11/19/us-news/elon-musk-remains-bullish-over-matt-gaetz-ag-nomination-despite-sex-trafficking-allegations-our-hammer-of-justice/,2024-11-19T16:13:28Z,"Tesla CEO Elon Musk fired off an optimistic post Tuesday about attorney general pick and former Rep. Matt Gaetz, declaring that he will bring the “hammer of justice” against President-elect Donald Tr… [+2793 chars]"
Tesla,Insurance Journal,Admin,Trump Team Is Seeking to Ease US Rules for Self-Driving Cars,"Members of President-elect Donald Trump’s transition team have told advisers they plan to make a federal framework for self-driving vehicles one of the Transportation Department’s priorities, according to people familiar with the matter. If new rules enable w…",https://www.insurancejournal.com/news/national/2024/11/19/801782.htm,2024-11-19T15:59:50Z,"Members of President-elect Donald Trump’s transition team have told advisers they plan to make a federal framework for self-driving vehicles one of the Transportation Department’s priorities, accordi… [+5395 chars]"
Meta,Crypto Briefing,Vivian Nguyen,Michael Saylor to present Bitcoin investment strategy to Microsoft’s board,"Microsoft's consideration of Bitcoin investment could influence other major corporations to reevaluate their cash management strategies.
The post Michael Saylor to present Bitcoin investment strategy to Microsoft’s board appeared first on Crypto Briefing.",https://cryptobriefing.com/michael-saylor-bitcoin-investment-microsoft/,2024-11-20T02:50:41Z,"Key Takeaways
<ul><li>Michael Saylor will present a Bitcoin investment strategy to Microsoft's board.</li><li>The board previously argued that Microsoft already evaluates various assets, including B… [+1965 chars]"
Meta,The Times of India,Reuters,Qualcomm 'positive' on Trump administration as it forecasts chip sales growth,"Qualcomm executives made the remarks at an investor event in New York during which the company forecast $22 billion in combined revenue over the next five years from laptops, cars and other products outside its current stronghold in smartphones, a sharp growt…",https://economictimes.indiatimes.com/tech/technology/qualcomm-positive-on-trump-administration-as-it-forecasts-chip-sales-growth/articleshow/115469346.cms,2024-11-20T02:47:29Z,"Qualcomm said on Tuesday it was ""positive"" on President-elect Donald Trump's incoming administration and not concerned that proposed US tariffs on China would dampen its business in the country from … [+4070 chars]"
Meta,The Times of India,AP,Nvidia rivals focus on building a different kind of chip to power AI products,Rivals of Nvidia think they can compete with the chip giant in selling so-called AI inference chips that are more attuned to the day-to-day running of AI tools and designed to reduce some of the huge computing costs of generative AI.,https://economictimes.indiatimes.com/tech/artificial-intelligence/nvidia-rivals-focus-on-building-a-different-kind-of-chip-to-power-ai-products/articleshow/115469185.cms,2024-11-20T02:37:23Z,"Building the current crop of artificial intelligence chatbots has relied on specialized computer chips pioneered by Nvidia, which dominates the market and made itself the poster child of the AI boom.… [+5674 chars]"
Meta,Heropress.com,Akshaya Rane,HeroPress: From Attendee to Contributor: My WordPress Journey,"Here is Akshaya reading her own story aloud.





Howdy, friends!



I’m Akshaya Rane, a fellow WordPress enthusiast from the vibrant suburbs of Mumbai, India. You’ll often find me at WordPress meetups, WordCamps, and Do Actions, eagerly soaking in the energy…",https://heropress.com/essays/from-attendee-to-contributor-my-wordpress-journey/,2024-11-20T02:30:00Z,"Here is Akshaya reading her own story aloud.
Howdy, friends!
Im Akshaya Rane, a fellow WordPress enthusiast from the vibrant suburbs of Mumbai, India. Youll often find me at WordPress meetups, Word… [+3452 chars]"
Meta,Lexblog.com,Kevin O'Keefe,Bluesky Captures My Attention Like Twitter Did 18 Years Ago,"Something about the new social media platform, Bluesky, has caught my attention as did Twitter, eighteen years ago. My former COO and friend turned me on to BlueSky a ways back. Other than creating an account and following him and him following me, I did noth…",https://kevin.lexblog.com/2024/11/19/bluesky-is-attracting-me-as-twitter-did-in-2006/,2024-11-20T01:49:49Z,"Something about the new social media platform, Bluesky, has caught my attention as did Twitter, eighteen years ago. 
My former COO and friend turned me on to BlueSky a ways back. Other than creating… [+2667 chars]"
Meta,SiliconANGLE News,James Farrell,Meta is now letting users tinker with Instagram’s algorithm recommendation system,"In a move that will please some of Instagram’s critics, the company will now allow users to reset the recommendation system that powers what they see in their feeds. For years now, Instagram has been in the sights of child health experts who believe apps like…",https://siliconangle.com/2024/11/19/meta-now-letting-users-tinker-instagrams-algorithm-recommendation-system/,2024-11-20T01:40:23Z,"In a move that will please some of Instagrams critics, the company will now allow users to reset the recommendation system that powers what they see in their feeds.
For years now, Instagram has been… [+2879 chars]"
Meta,TheWrap,Loree Seitz,‘Interior Chinatown’ Star Jimmy O. Yang Says Hulu Show Mirrors His Hollywood Trajectory: ‘I Was Chinese Teenager No. 1’,"The actor tells TheWrap about playing Willis Wu, a man stuck in the background of a police procedural show whose luck starts to change
The post ‘Interior Chinatown’ Star Jimmy O. Yang Says Hulu Show Mirrors His Hollywood Trajectory: ‘I Was Chinese Teenager No…",https://www.thewrap.com/interior-chinatown-hulu-jimmy-o-yang-interview/,2024-11-20T01:40:22Z,"In Hulus Interior Chinatown, Jimmy O. Yang stars as Willis Wu, a generic Asian man stuck in the background of police procedural show, whose luck begins to shift when he breaks into a leading role a t… [+4585 chars]"
Meta,Wordpress.org,desrosj,"Changeset [59427]: Options, Meta APIs: Ensure duplicate salts are properly flagged. ...","Options, Meta APIs: Ensure duplicate salts are properly flagged.


Improvements were made in 6.7 to ensure that salts stored in the database were primed more efficiently.


The logic added to accomplish this suffered from an edge case where array indexes were…",https://core.trac.wordpress.org/changeset/59427,2024-11-20T01:37:43Z,"Options, Meta APIs: Ensure duplicate salts are properly flagged.
Improvements were made in 6.7 to ensure that salts stored in the database were primed more efficiently.
The logic added to accomplis… [+231 chars]"
Meta,Mediagazer.com,,A lawsuit against Netflix and Meta claims the two made a deal where Meta scaled back original video programming in trade for Netflix data and ad spending (Winston Cho/The Hollywood Reporter),"Winston Cho / The Hollywood Reporter:
A lawsuit against Netflix and Meta claims the two made a deal where Meta scaled back original video programming in trade for Netflix data and ad spending  —  The proposed class action points to Meta's streaming ambitions …",https://mediagazer.com/241119/p21,2024-11-20T01:35:03Z,"Mediagazer presents the day's must-read media news on a single page.
The media business is in tumult: from the production side to
the distribution side, new technologies are upending the industry.… [+416 chars]"
Meta,Tryparity.com,wilson090,Meta Uses LLMs to Improve Incident Response,How Meta Uses LLMs to Improve Incident Response (and how you can too) - Meta used LLMs to root cause incidents with 42% accuracy. Here's how they did it and how you can do it too.,https://www.tryparity.com/blog/how-meta-uses-llms-to-improve-incident-response,2024-11-20T01:34:34Z,"In June, Meta released an article titled Leveraging AI for efficient incident response on their engineering blog. In this article, engineers outline how they leveraged large language models to improv… [+9130 chars]"
Meta,The Times of India,ETtech,Qcomm firms target gig fraud; common code for gaming,Happy Wednesday! The booming instant delivery sector is driving players to sharpen their hiring systems for gig workers. This and more in today’s ETtech Morning Dispatch.,https://economictimes.indiatimes.com/tech/newsletters/morning-dispatch/qcomm-firms-target-gig-fraud-common-code-for-gaming/articleshow/115467899.cms,2024-11-20T01:31:18Z,Happy Wednesday! The booming instant delivery sector is driving players to sharpen their hiring systems for gig workers. This and more in todays ETtech Morning Dispatch.Also in the letter:Flipkart bo… [+6744 chars]
Meta,Deadline,jillg366,"Netflix, Meta Sued Over “Quid Pro Quo” To Neutralize Facebook Watch Video Service",A lawsuit seeking class action status accuses Meta of rolling back its now shuttered Facebook Watch streaming video service to give Netflix a clear path as part of a deal to split the spoils of the new digital landscape. The antitrust suit filed in U.S. Distr…,http://deadline.com/2024/11/netflix-meta-sued-over-deal-to-neutralize-facebook-watch-1236181873/,2024-11-20T01:31:07Z,A lawsuit seeking class action status accuses Meta of rolling back its now shuttered Facebook Watch streaming video service to give Netflix a clear path as part of a deal to split the spoils of the n… [+4176 chars]
Meta,Exystence.net,exy,Opeth – The Last Will and Testament (2024),"Opeth’s polished 14th album, The Last Will and Testament, has been unsealed. The big question on everyone’s mind is: “Does the album deliver?” That one’s an easy “oh hell yes.” Let’s give a quick recap. If you’ve heard the first two singles, “§1” and “§3,” yo…",https://exystence.net/blog/2024/11/20/opeth-the-last-will-and-testament-2024/,2024-11-20T01:28:38Z,"Opeths polished 14th album, The Last Will and Testament, has been unsealed. The big question on everyones mind is: Does the album deliver? That ones an easy oh hell yes.Lets give a quick recap. If yo… [+4535 chars]"
Meta,Prtimes.jp,,『【事例から学べる】Meta広告でCV数17倍＆LINE運用でCV数3倍UPする方法』ウェビナー開催〈無料〉,"[株式会社WonderSpace]
[画像1: https://prcdn.freetls.fastly.net/release_image/73985/409/73985-409-2e8deeda59a397b1d1fa6e4a7547d5b5-1920x1080.png?width=536&quality=85%2C75&format=jpeg&auto=webp&fit=bounds&...",https://prtimes.jp/main/html/rd/p/000000409.000073985.html,2024-11-20T01:00:00Z,"https://k3ws.wonderspace.co.jp/form/241204_seminar
Meta
LINE
WonderSpace 
MetaCV17LINECV3UP
Meta
Meta
WonderSpaceLINE
MetaLINE
<ol><li>Meta 
</li></ol>WonderSpace
<ol><li>LINE
</li><li>LI… [+403 chars]"
Meta,Kernel.org,Linus Torvalds,Merge tag 'timers-core-2024-11-18' of git://git.kernel.org/pub/scm/linux/kernel/git/tip/tip,,https://git.kernel.org/pub/scm/linux/kernel/git/torvalds/linux.git/commit/?id=bf9aa14fc523d2763fc9a10672a709224e8fcaf4,2024-11-20T00:35:06Z,"Pull timer updates from Thomas Gleixner:
 ""A rather large update for timekeeping and timers:
- The final step to get rid of auto-rearming posix-timers
posix-timers are currently auto-rearmed by th… [+223369 chars]"
Meta,ABC News (AU),Jamie Tram,The lack of decent roles for Asian actors is the core of absurdist comedy series Interior Chinatown,"From Henry Golding to Manny Jacinto, Asian actors often struggle to break into the Hollywood A-list. New series Interior Chinatown is a playful look at what happens when an unknown waiter is finally given a big break.",https://www.abc.net.au/news/2024-11-20/review-chinatown-interior-chloe-bennet-jimmy-o-yang/104619962,2024-11-20T00:35:04Z,"Interior Chinatown is built around a genuinely funny, pointed conceit: what if, for once, one of the many Asian background characters in TV could finally become the lead?
What: A Chinatown waiter li… [+5734 chars]"
Meta,New Zealand Herald,Alex Casey,Netflix ANZ: Has the streaming giant forgotten about New Zealand?,'There’s no sign of any New Zealand commissions.',https://www.nzherald.co.nz/entertainment/netflix-anz-has-the-streaming-giant-forgotten-about-new-zealand/6ZU52BCPI5HO7H42HMERVB6SUM/,2024-11-20T00:30:46Z,"Its been an amazing journey to be able to work with incredible storytellers, he said in his launch speech in Sydney, going on to list exclusively Australian shows telling Australian stories. Weve cre… [+6632 chars]"
Meta,The Times of India,Himanshi Lohchab,"WhatsApp becomes more business friendly, offers service messages for free","Until now, service messages - such as customer queries on order status, flight ticket rescheduling, etc. - on WhatsApp were charged Rs 0.25 in India. SMS costs Rs 0.12-0.15, while Google's RCS (rich communication services) is priced Rs 0.20-0.25. The latest m…",https://economictimes.indiatimes.com/tech/technology/whatsapp-becomes-more-business-friendly-offers-service-messages-for-free/articleshow/115461342.cms,2024-11-20T00:30:00Z,"WhatsApp has made customer service messaging free for businesses on its platform, turning it into the cheapest channel for enterprise communication, in a bid to enhance AI chatbot conversations and i… [+2027 chars]"
Meta,Motley Fool Australia,Zach Bristow,"Could the S&P 500 Index hit 6,500 by the end of 2025?","Could the index climb higher?
The post Could the S&P 500 Index hit 6,500 by the end of 2025? appeared first on The Motley Fool Australia.",https://www.fool.com.au/2024/11/20/could-the-sp-500-index-hit-6500-by-the-end-of-2025/,2024-11-20T00:12:19Z,"Several heavyweights predict a strong finish for the S&amp;P 500 Index (SP: .INX) in the next two years, which could be good news for those seeking exposure to US shares. 
As a reminder, the S&amp;P… [+3249 chars]"
Meta,Mercola.com,none,Indications of PFAS 'Forever Chemicals' and Fluoride in Powdered Electrolytes — Buying Guide,"Are there indications of PFAS ""forever chemicals"" and/or fluoride inside your favorite powdered electrolytes? Mamavation community members asked us these questions about their favorite electrolyte products to protect their families from the potential health i…",https://articles.mercola.com/sites/articles/archive/2024/11/20/pfas-and-fluoride-in-powdered-electrolytes.aspx,2024-11-20T00:00:00Z,"Mercola proudly supports these charities and organizations. View All 
Disclaimer: The entire contents of this website are based upon the opinions of Dr. Mercola, unless otherwise noted. Individual a… [+1007 chars]"
Meta,Redhat.com,,Rationalizing virtualized workloads: Load balancers and reverse proxies,"Many organizations are now migrating virtualized workloads to Red Hat OpenShift Virtualization.In many cases, this migration consists of a lift-and-shift (rehosting) approach, in which a virtual machine (VM) is moved from a source platform to OpenShift Virtua…",https://www.redhat.com/en/blog/rationalizing-virtualized-workloads-load-balancers-and-reverse-proxies,2024-11-20T00:00:00Z,"Many organizations are now migrating virtualized workloads to Red Hat OpenShift Virtualization.
In many cases, this migration consists of a lift-and-shift (rehosting) approach, in which a virtual ma… [+16114 chars]"
Meta,2ality.com,,Mastodon’s weaknesses and how to fix them,"As a web developer, I love Mastodon:
<ul>
<li>Since Twitter became X, there are enough web dev people here.</li>
<li>I’m happy with the web app – it even has several nice touches where it is better than Twitter.</li>
<li>I’m not locked into an ecosystem that …",https://2ality.com/2024/11/mastodon-weaknesses.html,2024-11-20T00:00:00Z,"As a web developer, I love Mastodon:
<ul><li>Since Twitter became X, there are enough web dev people here.</li><li>Im happy with the web app it even has several nice touches where it is better than … [+16593 chars]"
Meta,Kernel.org,Linus Torvalds,Merge tag 'irq-core-2024-11-18' of git://git.kernel.org/pub/scm/linux/kernel/git/tip/tip,,https://git.kernel.org/pub/scm/linux/kernel/git/torvalds/linux.git/commit/?id=5c2b050848337f393011ee7fcd2e9f2663eec40d,2024-11-19T23:54:19Z,"Pull interrupt subsystem updates from Thomas Gleixner:
 ""Tree wide:
- Make nr_irqs static to the core code and provide accessor functions
 to remove existing and prevent future aliasing problems w… [+76329 chars]"
Meta,[Removed],,[Removed],[Removed],https://removed.com,2024-11-19T23:49:55Z,[Removed]
Meta,TheWrap,Sharon Knolle,"Netflix, Meta Sued Over Anticompetitive Streaming Agreement That Led to End of Facebook Watch","The suit argues that the deal between Reed Hastings and Mark Zuckerberg ""decreased consumer choices"" while ""at the same time increasing consumer costs""
The post Netflix, Meta Sued Over Anticompetitive Streaming Agreement That Led to End of Facebook Watch appe…",https://www.thewrap.com/netflix-meta-sued-over-anticompetitive-streaming-agreement/,2024-11-19T23:43:50Z,"Netflix and Meta are being sued for an alleged anticompetitive agreement that, the suit states, involved the deliberate hobbling of Facebook Watch. 
The proposed class action suit, which was filed i… [+1950 chars]"
Meta,USA Today,Joedy McCreary,Trump didn't compare 'Morning Joe' host to 'scolded dog.' Post is fabricated,The image is a fabrication that appeared to originate from a satirical account. There is no record of the post on Trump's Truth Social account.,https://www.usatoday.com/story/news/factcheck/2024/11/19/trump-post-joe-scarborough-mika-brzezinski-msnbc-fact-check/76428231007/,2024-11-19T23:32:00Z,"A Nov. 18 Threads post (direct link, archive link) shows what appears to be a Truth Social post from President-elect Donald Trump about his meeting with MSNBC broadcasters Joe Scarborough and Mika Br… [+2759 chars]"
Meta,The BMJ,"Alex, A. M., Levendosky, A. A., Bogat, G. A., Muzik, M., Nuttall, A. K., Knickmeyer, R. C., Lonstein, J. S.",Stress and mental health symptoms in early pregnancy are associated with the oral microbiome,"Background Research has revealed associations between microbes of the gastrointestinal tract and stress, anxiety and depression in pregnant or postpartum women. While these studies suggest a gut-brain-behaviour axis, no studies have examined microbes of the o…",https://mentalhealth.bmj.com/content/27/1/e301100,2024-11-19T23:30:19Z,"Background
Poor mental health affects &gt;1520% of pregnant women worldwide1 and significantly reduces maternal well-being, impairs mothers capacity for infant caregiving, and imperils child develop… [+12342 chars]"
Meta,Pypi.org,jorgesilva.ti@hotmail.com,sshtmux added to PyPI,Powerful SSH terminal manager,https://pypi.org/project/sshtmux/,2024-11-19T23:25:13Z,"Links
About
This project is a fork from SSHClick. Thanks karlot!
Inspired by the idea of a terminal connection manager and powerful software such as MRemoteNG, SSHTMux brings several new features … [+14181 chars]"
Meta,Ozbargain.com.au,Bik,"20% off Selected Full Priced Sunglasses, Glasses Frames, Remix and Accessories (Includes Meta Smart Glasses) @ Ray-Ban","Just received an email from Rayban with a code which gives 20% off their glasses including Meta ones. Looks like you can signup from the website to receive the discount.

Terms of Sale


 <ol>
 <li>20% off selected full priced sunglasses, glasses frames, remi…",https://www.ozbargain.com.au/node/878238,2024-11-19T23:16:41Z,"All trademarks are owned by their respective owners.OzBargain is an independent community website which has no association with nor endorsement by the respective trademark owners.
Copyright © 2006-2… [+32 chars]"
