company,source,author,title,description,url,published_at,content
Netflix,IndieWire,Samantha Bergeson,‘The Merry Gentlemen’ Review: A Shirtless Chad Michael Murray Can’t Spice Up This Cold Netflix Holiday Rom-Com,Britt Robertson co-leads the formulaic feature that is missing more than a few festive moments...and shirts.,https://www.indiewire.com/criticism/movies/the-merry-gentlemen-review-chad-michael-murray-netflix-1235067092/,2024-11-20T00:00:00Z,"We know you remember the photos seen on the ‘gram: Chad Michael Murray, shirtless, cowboy-hatted, and doing a body roll. Perhaps you screen-shotted them, too. Alas, no matter how excited you might be… [+3411 chars]"
Netflix,JoBlo.com,Kevin Fraser,Genesis Rodriguez in talks to join The Night Agent season 3,"Lioness star Genesis Rodriguez is in talks to join season 3 of The Night Agent, the hit action thriller series on Netflix.
The post Genesis Rodriguez in talks to join The Night Agent season 3 appeared first on JoBlo.",https://www.joblo.com/genesis-rodriguez-the-night-agent-season-3/,2024-11-19T23:53:57Z,"Lioness star Genesis Rodriguez is in talks to join season 3 of The Night Agent, the hit action thriller series on Netflix.
The Night Agent received an early season 3 renewal last month, and the cast… [+2266 chars]"
Netflix,Marca,marca.com,Tyson-Paul Shatters Records: $18.1M gate and streaming milestones rock combat sports,"The showdown between boxing legend Mike Tyson and YouTuber-turned-boxer Jake Paul might not have lived up to its hype in the ring, but it delivered a jaw-dropping financial knockou",https://www.marca.com/en/boxing/2024/11/20/673d220c46163f39a08b4576.html,2024-11-19T23:50:33Z,"The showdown between boxing legend Mike Tyson and YouTuber-turned-boxer Jake Paul might not have lived up to its hype in the ring, but it delivered a jaw-dropping financial knockout.
The event, host… [+2073 chars]"
Netflix,Variety,Emiliana Betancourt,Robert De Niro Netflix Conspiracy Thriller Series ‘Zero Day’ Sets Premiere Date,The new Netflix drama series “Zero Day” starring Robert De Niro has set its official premiere date. The conspiracy thriller series will debut on the streamer on Feb. 20. Variety exclusively reported the series was in the works back in 2022. The six-episode se…,https://variety.com/2024/tv/news/robert-de-niro-netflix-series-zero-day-premiere-date-1236214858/,2024-11-19T23:48:48Z,"The new Netflix drama series “Zero Day” starring Robert De Niro has set its official premiere date. 
The conspiracy thriller series will debut on the streamer on Feb. 20. Variety exclusively reporte… [+1425 chars]"
Netflix,Uxdesign.cc,Cláudia Delgado,The money talk in UX,"Let’s be short and clear: businesses only exist to make money. All their placed bets are based on the sooner or later expected profit. To determine the viability of any business case, we need to…",https://uxdesign.cc/the-money-talk-e1fdee769b17,2024-11-19T23:46:59Z,"Lets be short and clear: businesses only exist to make money. All their placed bets are based on the sooner or later expected profit.
To determine the viability of any business case, we need to calc… [+12923 chars]"
Netflix,TODAY,Liz Kreutz and Andrew Blankstein,Newsom says he’ll hold off on Menendez brothers decision until new Los Angeles DA weighs in,Menendez brothers' clemency waits for new LA DA Nathan Hochman review after DA Gascón's resentencing support.,https://www.today.com/news/newsom-menendez-brothers-decision-rcna180913,2024-11-19T23:44:24Z,LOS ANGELES  Erik and Lyle Menendezs bid for freedom hit another possible roadblock this week as California Gov. Gavin Newsom said that he will not review their clemency request until after the incom… [+3789 chars]
Netflix,TheWrap,Sharon Knolle,"Netflix, Meta Sued Over Anticompetitive Streaming Agreement That Led to End of Facebook Watch","The suit argues that the deal between Reed Hastings and Mark Zuckerberg ""decreased consumer choices"" while ""at the same time increasing consumer costs""
The post Netflix, Meta Sued Over Anticompetitive Streaming Agreement That Led to End of Facebook Watch appe…",https://www.thewrap.com/netflix-meta-sued-over-anticompetitive-streaming-agreement/,2024-11-19T23:43:50Z,"Netflix and Meta are being sued for an alleged anticompetitive agreement that, the suit states, involved the deliberate hobbling of Facebook Watch. 
The proposed class action suit, which was filed i… [+1950 chars]"
Netflix,Boston Herald,BestReviews,Early Black Friday deals are live — don’t miss out,"Black Friday deals are already here, and there's lots of savings to be had! Check out these deals we found so you can make the most of the sales.",https://www.bostonherald.com/2024/11/19/early-black-friday-deals-are-live-dont-miss-out-2/,2024-11-19T23:37:55Z,"There’s something for everyone with these can’t-miss deals
For seasoned shoppers, Black Friday is a holiday in its own right. Whether you’re ready to start ticking names off your holiday shopping li… [+7687 chars]"
Netflix,Deadline,anthonypauldalessandro,Rob Corddry Signs With Buchwald & Artists First,"EXCLUSIVE: Four-time Primetime Emmy winner Rob Corddry has inked with Buchwald and Artists First for representation.  The Weymouth, Massachusetts native and Upright Citizens Brigade alum was the co-creator EP, writer and star of Adult Swim’s long-running come…",http://deadline.com/2024/11/rob-corddry-buchwald-artists-first-1236181857/,2024-11-19T23:35:28Z,"EXCLUSIVE: Four-time Primetime Emmy winner Rob Corddry has inked with Buchwald and Artists First for representation. 
The Weymouth, Massachusetts native and Upright Citizens Brigade alum was the co-… [+1813 chars]"
Netflix,CNN,Don Riddell,Meet the man spearheading Jake Paul’s divisive boxing career | CNN,"To some, he’s the promoter behind the fight that “broke the internet” – the man responsible for bringing the bout between Jake Paul and Mike Tyson to an audience of millions – but Nakisa Bidarian refers to himself as “just an accountant.”",https://www.cnn.com/2024/11/19/sport/nakisa-bidarian-jake-paul-boxing-spt-intl/index.html,2024-11-19T23:29:16Z,"To some, hes the promoter behind the fight that broke the internet the man responsible for bringing the controversial bout between Jake Paul and Mike Tyson to an audience of millions.
But Nakisa Bid… [+5847 chars]"
Netflix,New York Post,Christian Arnold,Jake Paul-Mike Tyson fight made history with 108 million global viewers: Netflix,"Streaming giant Netflix said that 108 million people worldwide watched last Friday’s bout between Mike Tyson and Jake Paul, calling it the “most-streamed global sporting event ever.”",https://nypost.com/2024/11/19/sports/jake-paul-mike-tyson-fight-has-108-million-global-viewers-netflix-says/,2024-11-19T23:27:11Z,"Streaming giant Netflix said that 108 million people worldwide watched last Fridays bout between Mike Tyson and Jake Paul, calling it the most-streamed global sporting event ever in a post on social … [+1975 chars]"
Netflix,NBC News,Liz Kreutz and Andrew Blankstein and Tim Stelloh,Gavin Newsom says won't make Menendez brothers decision until new Los Angeles DA weighs in,Erik and Lyle Menendez’s bid for freedom hit another possible roadblock this week as California Gov.,https://www.nbcnews.com/news/us-news/menendez-brothers-hochman-gascon-newsom-rcna180878,2024-11-19T23:23:45Z,LOS ANGELES  Erik and Lyle Menendezs bid for freedom hit another possible roadblock this week as California Gov. Gavin Newsom said he will not review their clemency request until after the incoming L… [+3852 chars]
Netflix,Radaronline.com,Lauren McIver,New LA District Attorney Asks 'What's the Point' in Watching Menendez Brothers Documentary After Taking On Their Freedom Bid,"The new Los Angeles District Attorney, Nathan Hochman, won't be utilizing the Netflix documentary or 'Monster' series to help review the famous case.",https://radaronline.com/p/la-district-attorney-asks-point-watching-menendez-brothers-documentary-taking-freedom-bid/,2024-11-19T23:15:50Z,"Source: Fox News/MEGAThe new Los Angeles District Attorney, Nathan Hochman, won't be utilizing the Netflix documentary or 'Monster' series to help review the famous case. 
New LA District Attorney N… [+3622 chars]"
Netflix,Eurogamer.net,Matt Wales,"Minecraft movie's second trailer brings deep Steve lore, tree punching, bee","It'd be fair to say the live-action Minecraft movie's first trailer didn't exactly arrive to rapturous applause. But now Warner Bros. and Legendary Pictures are back for a second try, this time unleashing the deep Steve lore, tree punching, teleporting Ender …",https://www.eurogamer.net/minecraft-movies-second-trailer-brings-deep-steve-lore-tree-punching-square-bee,2024-11-19T23:15:36Z,"It'd be fair to say the live-action Minecraft movie's first trailer didn't exactly arrive to rapturous applause. But now Warner Bros. and Legendary Pictures are back for a second try, this time unlea… [+2284 chars]"
Netflix,Sky News Australia,Laura Grassby,Netflix sued over issues with streaming quality and glitches during historic matchup between Mike Tyson and Jake Paul,Netflix is facing a lawsuit over complaints about poor streaming quality and technical glitches during Mike Tyson and Jake Paul’s historic boxing match last week.,https://www.skynews.com.au/business/tech-and-innovation/netflix-sued-over-issues-with-streaming-quality-during-historic-matchup-between-mike-tyson-and-jake-paul/news-story/3de63ebc9b77f6f8629c0c3f9b46ce02,2024-11-19T23:12:19Z,"Netflix is facing a lawsuit over complaints about poor streaming quality and technical glitches during Mike Tyson and Jake Paul’s historic boxing match last week.
The eight-round fight in Texas was … [+2268 chars]"
Netflix,Just Jared,Just Jared,Kaitlyn Dever Plays Real-Life Con Artist in Netflix's 'Apple Cider Vinegar' Series - Watch the Trailer!,"Kaitlyn Dever is starring in the new Netflix series Apple Cider Vinegar, based on “true-ish” story of a real-life con artist. Set at the birth of Instagram, Apple Cider Vinegar follows two young women who set out to cure their life-threatening illnesses throu…",https://www.justjared.com/2024/11/19/kaitlyn-dever-plays-real-life-con-artist-in-netflixs-apple-cider-vinegar-series-watch-the-trailer/,2024-11-19T23:11:54Z,"Kaitlyn Dever is starring in the new Netflix series Apple Cider Vinegar, based on “true-ish” story of a real-life con artist.
Set at the birth of Instagram, Apple Cider Vinegar follows two young wom… [+697 chars]"
Netflix,ComicBook.com,Nicole Drum,Yellowjackets: Everything We Know About Season 3,"It’s almost time to head back to the wilderness. On Tuesday, it was confirmed that Yellowjackets will return for its eagerly anticipated third season sooner than fans expected — and on a date they’ll love. The series is set to return on Friday, February 14, 2…",http://comicbook.com/tv-shows/news/yellowjackets-everything-we-know-about-season-3/,2024-11-19T23:08:37Z,"Its almost time to head back to the wilderness. On Tuesday, it was confirmed that Yellowjackets will return for its eagerly anticipated third season sooner than fans expected and on a date theyll lov… [+3304 chars]"
Netflix,[Removed],,[Removed],[Removed],https://removed.com,2024-11-19T23:04:41Z,[Removed]
Netflix,Deadline,Dade Hayes,K-Pop Showcase The MAMA Awards To Stream Exclusively On Samsung TV Plus In U.S. And Other Big Markets,"The MAMA Awards, a major global showcase for k-pop, will stream live exclusively on Samsung TV Plus in the U.S. and other territories. The awards, whose name is short for Mnet Asian Music Awards, are sometimes called the Grammys of Asia. This year, they will …",http://deadline.com/2024/11/kpop-mama-awards-streaming-samsung-tv-plus-1236181785/,2024-11-19T23:04:14Z,"The MAMA Awards, a major global showcase for k-pop, will stream live exclusively on Samsung TV Plus in the U.S. and other territories.
The awards, whose name is short for Mnet Asian Music Awards, ar… [+2152 chars]"
Netflix,Cheezburger.com,"Limor Ben Zvi Reich, Limor Ben Zvi Reich",25 Seriously Sweet (and Sour) Sleeping Animal Snapshots for a Sound Siesta,"Sleeping: seemingly the most natural and innocent of life's events - even villains must sleep occasionally. However, in a domestic context, sleeping has become somewhat of a bone of contention. Family life can be greatly affected by each member's unique sleep…",https://cheezburger.com/37860613/25-seriously-sweet-and-sour-sleeping-animal-snapshots-for-a-sound-siesta,2024-11-19T23:00:00Z,"Sleeping: seemingly the most natural and innocent of life's events - even villains must sleep occasionally. However, in a domestic context, sleeping has become somewhat of a bone of contention. Famil… [+1147 chars]"
Netflix,InfoQ.com,Anthony Alford,QCon SF: Large Scale Search and Ranking Systems at Netflix,Moumita Bhattacharya spoke at QCon SF 2024 about state-of-the-art search and ranking systems. She gave an overview of the typical structure of these systems and followed with a deep dive into how Netflix created a single combined model to handle both tasks. B…,https://www.infoq.com/news/2024/11/qcon-sf-netflix-search-recommend/,2024-11-19T23:00:00Z,Moumita Bhattacharya spoke at QCon SF 2024 about state-of-the-art search and ranking systems. She gave an overview of the typical structure of these systems and followed with a deep dive into how Net… [+3056 chars]
Netflix,MMA Fighting,Mike Heck,‘Don’t be silly’: Francis Ngannou responds to talks of potential Jake Paul fight,Francis Ngannou shuts down a potential boxing match with Jake Paul in a recent interview.,https://www.mmafighting.com/2024/11/19/24300646/dont-be-silly-francis-ngannou-responds-to-talks-of-potential-jake-paul-fight,2024-11-19T23:00:00Z,"Photo by Cooper Neill/Getty Images

 

 Francis Ngannou has no interest in boxing Jake Paul.
Paul defeated Mike Tyson via unanimous decision in an eight-round headliner during Friday night’s Paul vs… [+2097 chars]"
Netflix,Slashdot.org,feedfeeder,Netflix says the Jake Paul vs. Mike Tyson fight was ‘the most-streamed sporting event ever’ - The Verge,Netflix says the Jake Paul vs. Mike Tyson fight was ‘the most-streamed sporting event ever’The Verge Paul-Tyson $18.1M gate sets non-Vegas recordESPN Netflix claims 108 million average minute audience during Jake Paul vs. Mike Tyson fightNBC Sports After Netf…,https://slashdot.org/firehose.pl?op=view&amp;id=175504301,2024-11-19T22:52:16Z,The Fine Print: The following comments are owned by whoever posted them. We are not responsible for them in any way.
Netflix,Footwear News,Mikelle Streethttp://mikelledstreet.com,"Kerry Washington Is Ready to Brave the Cold in Slick, Knee-High Glossy Boots",The shoes sport a stiletto heel of about four inches.,http://footwearnews.com/fashion/celebrity-style/kerry-washington-jimmy-choo-boots-six-triple-eight-screening-1234732451/,2024-11-19T22:51:18Z,Kerry Washington is ready for chillier temperatures to set in. The actor attended a special screening of Tyler Perry’s “The Six Triple Eight” film on Netflix. Washington stars in the drama as an army… [+2195 chars]
Netflix,ComingSoon.net,Maggie Dela Paz,Arcane Season 2 Act 3 Trailer Previews Netflix Show’s Final Episodes,"Netflix has finally released the Arcane Season 2 Act 3 trailer for the three-part series finale episodes of the hit action fantasy series. The final installment will officially resume this Saturday, November 23. Check out the Arcane Season 2 Act 3 trailer bel…",https://www.comingsoon.net/tv/trailers/1880702-arcane-season-2-act-3-trailer-netflix-show-final-episodes,2024-11-19T22:40:20Z,"Netflix has finally released the Arcane Season 2 Act 3 trailer for the three-part series finale episodes of the hit action fantasy series. The final installment will officially resume this Saturday, … [+1321 chars]"
Netflix,Forbes,"Thomas Brewster, Forbes Staff, 
 Thomas Brewster, Forbes Staff
 https://www.forbes.com/sites/thomasbrewster/",The Wiretap: Who’s Afraid Of A Trumpian Encryption War?,Plus: FBI Investigates Possible China Hack Of Presidential Campaign Officials’ iPhones,https://www.forbes.com/sites/thomasbrewster/2024/11/19/trump-crypto-war-fear/,2024-11-19T22:39:10Z,"The Wiretap is your weekly digest of cybersecurity, internet privacy and surveillance news. To get it in your inbox, subscribe here.
(Photo by BRENDAN SMIALOWSKI/AFP via Getty Images)
AFP via Getty… [+5747 chars]"
Netflix,CinemaBlend,Carly Levy,I Did Not Have Prince Harry Admitting He Wanted A 'Lower Back' Or 'A--' Tattoo On My Bingo Card This Week,Prince Harry would get inked?!,https://www.cinemablend.com/television/prince-harry-admitting-wanted-a-lower-back-tattoo,2024-11-19T22:37:20Z,"I’m used to Prince Harry getting real and dropping bombshells about his personal life. His new memoir Spare 
revealed some wild allegations
 about his upbringing and there were many revelations dur… [+2750 chars]"
Netflix,[Removed],,[Removed],[Removed],https://removed.com,2024-11-19T22:37:18Z,[Removed]
Netflix,The-sun.com,Henry Tomlinson,UPDATE: Paul vs Tyson raked in 108 million viewers worldwide...,NETFLIX has confirmed eye-watering Jake Paul vs Mike Tyson viewing figures – making it the most watched fight since Muhammad Ali. The underwhelming fight ended in a unanimous win for Paul ove…,https://www.the-sun.com/sport/12928357/netflix-boxing-mike-tyson-jake-paul-viewing-figures/,2024-11-19T22:34:38Z,"NETFLIX has confirmed eye-watering Jake Paul vs Mike Tyson viewing figures - making it the most watched fight since Muhammad Ali.
The underwhelming fight ended in a unanimous win for Paul over the b… [+2882 chars]"
Netflix,Forbes,"Kris Holt, Contributor, 
 Kris Holt, Contributor
 https://www.forbes.com/sites/krisholt/","Today’s NYT ‘Connections’ Hints And Answers For Wednesday, November 20",Looking for some help with Wednesday's NYT Connections? Some hints and the answers for today's game are right here.,https://www.forbes.com/sites/krisholt/2024/11/19/nyt-connections-today-help-clues-hints-answers-wednesday-november-20-262/,2024-11-19T22:30:00Z,"Find the links between the words to win today's game of Connections.
getty
Looking for Tuesdays Connections hints and answers instead? You can find them here:
ForbesTodays NYT Connections Hints An… [+5346 chars]"
Netflix,TheWrap,Jeremy Fuster,"Louisiana Senate Restores, but Reduces, State Tax Credit Program","Legislators lower the incentive program's cap from $150 million to $125 million
The post Louisiana Senate Restores, but Reduces, State Tax Credit Program appeared first on TheWrap.",https://www.thewrap.com/louisiana-senate-restores-but-reduces-state-tax-credit-program/,2024-11-19T22:27:58Z,"The Louisiana State Senate has voted to restore the states film and TV tax credit program after the State Assembly voted to sunset it last week, albeit with a lower cap. 
On Sunday, hundreds of film… [+1920 chars]"
Netflix,Livejournal.com,theemii,Apple Cider Vinegar | Official Teaser | Netflix,"What happens when your health and wellness advice comes from a fraudster? Inspired by a true story that was based on a lie, Apple Cider Vinegar stars Kaitlyn Dever as Belle Gibson, an Australian wellness influencer who claims to have cured her terminal brain …",https://ohnotheydidnt.livejournal.com/129581712.html,2024-11-19T22:27:48Z,"What happens when your health and wellness advice comes from a fraudster? 
Inspired by a true story that was based on a lie, Apple Cider Vinegar stars Kaitlyn Dever as Belle Gibson, an Australian we… [+1082 chars]"
Netflix,Maketecheasier.com,Karrar Haider,Beware! Legal Tricks Online Sellers Use to Manipulate Your Purchase,Don't let online sellers trick you into making an incorrect decision. Sellers use these common tricks to influence your online purchasing.,https://www.maketecheasier.com/legal-tricks-online-sellers-use/,2024-11-19T22:25:00Z,"Think you’re getting a great deal online? Think again. Sellers can use many legal, yet sneaky tricks to influence your buying decisions and squeeze more money out of you. Watch for these tricks from … [+7626 chars]"
Netflix,IndieWire,Christian Blauvelt,"Cate Blanchett, Mandy Walker, and More Headline Last-Minute Diversity Panel at Camerimage Following Controversy","""The idea that inclusion dilutes excellence is not up for debate,"" said producer Anna Higgs, who hosted the panel, in a light rebuke of the festival director's controversial comments that had implied as much.",https://www.indiewire.com/news/breaking-news/cate-blanchett-diversity-panel-camerimage-controversy-1235067544/,2024-11-19T22:21:39Z,The continuing fallout over Camerimage CEO Marek Zydowicz’s Cinematography Today column has forced the festival into damage control. A hastily assembled panel November 19 took on diversity and inclus… [+6729 chars]
Netflix,Stacker.com,Stacker,Most popular cooking TV show hosts,"Everyone eats, which means most people cook every day. For those who have anxiety about cooking, don’t know a saucepan from a skillet, or just need a little inspiration, help is on TV. While public broadcasts and television dramas debuted as early as the 1920…",https://stacker.com/celebrities/most-popular-cooking-tv-show-hosts,2024-11-19T22:16:46Z,"The best cooking shows thrive due to their hosts. Stacker examined survey data from YouGov to find the most popular food TV show hosts of all time.
 - Brad Barket // Getty Images
Everyone eats, whi… [+19121 chars]"
Netflix,New York Post,Matt Levy,"Matt Rife announces 2025 ‘Stay Golden Tour,’ MSG show. Get tickets now",The freewheeling comic will riff at the Garden on July 19.,https://nypost.com/2024/11/19/entertainment/matt-rife-announces-2025-stay-golden-tour-msg-show-get-tickets-now/,2024-11-19T22:13:15Z,Vivid Seats is the New York Post's official ticketing partner. We may receive revenue from this partnership for sharing this content and/or when you make a purchase. Featured pricing is subject to ch… [+8234 chars]
Netflix,ABC News,The Associated Press,Jake Paul-Mike Tyson was highest-grossing combat event in Texas at $18.1M,Jake Paul’s promotions company says the fighter's unanimous decision over Mike Tyson was the highest-grossing combat sports event in Texas at $18.1 million,https://abcnews.go.com/Entertainment/wireStory/jake-paul-mike-tyson-highest-grossing-combat-event-116026824,2024-11-19T22:13:00Z,"ARLINGTON, Texas -- Jake Paul's unanimous decision over Mike Tyson was the highest-grossing combat sports event in Texas at $18.1 million, the promotions company co-founded by Paul said Tuesday.
The… [+1388 chars]"
Netflix,Slashdot.org,feedfeeder,Netflix stock hits record after reveal that Tyson-Paul had 108 million viewers - MarketWatch,"Netflix stock hits record after reveal that Tyson-Paul had 108 million viewersMarketWatch Netflix claims 108 million average minute audience during Jake Paul vs. Mike Tyson fightNBC Sports After Netflix Faced Complaints About Jake Paul And Mike Tyson Fight, O…",https://slashdot.org/firehose.pl?op=view&amp;id=175504081,2024-11-19T22:12:27Z,"If computers take over (which seems to be their natural tendency), it will
serve us right.
-- Alistair Cooke"
Netflix,What's on Netflix,Kasey Moore,‘Beauty in Black’ Season 2 Netflix Renewal Status & 2025 Release Date Confirmed For Part 2,The show has already got a season 2 renewal with more episodes already filmed and viewing figures suggest more could come beyond that.,https://www.whats-on-netflix.com/news/beauty-in-black-season-2-netflix-renewal-status-2025-release-for-part-2/,2024-11-19T22:07:40Z,"Picture: Netflix
Tyler Perry is ending 2024 strong with a brand new scripted series, Beauty in Black. The first eight episodes of the series premiered in October 2024 and have been picking up solid … [+4118 chars]"
Netflix,GeekTyrant,Joey Paur,ARCANE Producer Debunks Reports That There Was Originally a Five-Season Plan,"Riot Games co-founder, League of Legends creator, and Arcane producer Marc Merrill has cleared up some confusion surrounding Arcane and its reported original “five-season” plan.In a report that revealed Arcane is the most expensive animated show ever made wit…",https://geektyrant.com/news/arcane-producer-debunks-reports-that-there-was-originally-a-five-season-plan,2024-11-19T22:01:00Z,"Riot Games co-founder, League of Legends creator, and Arcaneproducer Marc Merrill has cleared up some confusion surrounding Arcane and its reported original five-season plan.
In a report that reveal… [+2034 chars]"
Netflix,Variety,Richard Kuipers,‘Abang Adik’ Review: Malaysia’s Oscar Submission Is a Touching Tale of Brotherhood and Identity,"A deeply moving humanist drama with potent social and political undercurrents, “Abang Adik” charts the hardships faced by two orphaned Malaysian brothers who have no legal identity in the country of their birth. The mightily impressive first feature written a…",https://variety.com/2024/film/reviews/abang-adik-review-1236214059/,2024-11-19T22:00:00Z,"A deeply moving humanist drama with potent social and political undercurrents, “Abang Adik” charts the hardships faced by two orphaned Malaysian brothers who have no legal identity in the country of … [+5931 chars]"
Netflix,Marca,marca.com,Jake Paul's time in the limelight after Mike Tyson bout could end with a startling admission,"The &quot;fight of the decade&quot; between Jake Paul and Mike Tyson did not exactly live up to the hype. While 70,000 fans looked on at AT&T Stadium and millions more watched at h",https://www.marca.com/en/boxing/2024/11/19/673cf931e2704e18798b45a0.html,2024-11-19T21:58:39Z,"The ""fight of the decade"" between Jake Paul and Mike Tyson did not exactly live up to the hype. While 70,000 fans looked on at AT&amp;T Stadium and millions more watched at home on Netflix, Paul over… [+2290 chars]"
