company,source,author,title,description,url,published_at,content
Google,USA Today,Danny Segura,"Analyzing UFC welterweight shake up: Rakhmonov vs. Machado Garry, Covington vs. Buckley","Shavkat Rakhmonov vs. Ian Machado Garry and Colby Covington vs. Joaquin Buckley? We discuss these UFC matchups on ""Spinning Back Clique.""",https://mmajunkie.usatoday.com/2024/11/ufc-welterweight-discussion-rakhmonov-machado-garry-covington-buckley,2024-11-20T00:45:43Z,"A lot is going on in the UFC’s welterweight division.
With UFC welterweight champion Belal Muhammad withdrawing from his first title defense at UFC 310 due to injury, the promotion was forced to mak… [+1125 chars]"
Google,Android Headlines,Akshay Kumar,Google Lens now helps you with your in-store shopping,Google Lens feature on Android and iOS will soon be able to help with in-store shopping by chcking prices and inventory.,https://www.androidheadlines.com/2024/11/google-lens-now-helps-you-with-your-in-store-shopping.html,2024-11-20T00:41:22Z,Google has announced that Google Lens is getting an AI-powered update to help users when they are shopping in-store. The new feature arrived after the company infused AI in Google Shopping last month… [+1845 chars]
Google,ABC News,ABC News,WATCH: Mom surprises kids with 'Bluey'-inspired Christmas tree,Samir and Samaya were completely surprised!,https://abcnews.go.com/GMA/Family/video/mom-surprises-kids-bluey-inspired-christmas-tree-116029694,2024-11-20T00:35:09Z,"<ul><li>Dr. Oz picked as Centers for Medicare and Medicaid Services administrator
</li><li>Trump picks Lutnick for commerce secretary job
</li><li>Trump defense secretary pick Pete Hegseth draws co… [+4274 chars]"
Google,New Zealand Herald,Alex Casey,Netflix ANZ: Has the streaming giant forgotten about New Zealand?,'There’s no sign of any New Zealand commissions.',https://www.nzherald.co.nz/entertainment/netflix-anz-has-the-streaming-giant-forgotten-about-new-zealand/6ZU52BCPI5HO7H42HMERVB6SUM/,2024-11-20T00:30:46Z,"Its been an amazing journey to be able to work with incredible storytellers, he said in his launch speech in Sydney, going on to list exclusively Australian shows telling Australian stories. Weve cre… [+6632 chars]"
Google,Digital Trends,Fionna Agomuoh,"Google may finally bring back the Pixelbook, but not how you think",A report suggests Google is in the beginning phases of developing its first Pixel laptop of the 2020s.,https://www.digitaltrends.com/computing/a-new-google-pixel-laptop-is-coming-to-compete-with-macbooks/,2024-11-20T00:27:08Z,"One of Google’s upcoming big projects could be a high-end laptop slated to be the next rival of the MacBook Pro.
An internal email obtained by Android Headlines detailed that Google has greenlit a p… [+2689 chars]"
Google,Android Headlines,Rishaj Upadhyay,Google might push stable Android 16 to the Pixel 6 series,"The popular Android insider, Mishaal Rahman, believes that the Pixel 6 series could get the stable Android 16 in 2025 for different reasons.",https://www.androidheadlines.com/2024/11/google-might-push-stable-android-16-to-the-pixel-6-series.html,2024-11-20T00:26:11Z,"Today, Google released the first developer preview for Android 16. At launch, the Android 16 DP1 system images are available for the Pixel 6 series and newer models. Considering the presence of the P… [+2720 chars]"
Google,Johnaugust.com,Drew Marquardt,"Scriptnotes, Episode 660: Moneyball, Transcript","The original post for this episode can be found here. John August: Hello and welcome, my name is John August. Craig Mazin: My name is Craig Mazin. John: You’re listening to episode 660 of Scriptnotes, a podcast about screenwriting and things that are interest…",https://johnaugust.com/2024/scriptnotes-episode-660-moneyball-transcript,2024-11-20T00:23:30Z,"The original post for this episode can be found here.
John August: Hello and welcome, my name is John August.
Craig Mazin: My name is Craig Mazin.
John: Youre listening to episode 660 of Scriptnot… [+90695 chars]"
Google,Hubspot.com,Diego Alamir,Predicting Customer Behavior and AI: My Journey to Understanding the Customer Mind [+ Pro Tips],Get a solid understanding of how to leverage AI to get inside your customers’ minds and create experiences that wow them.,https://blog.hubspot.com/service/predicting-customer-behavior-ai#article,2024-11-20T00:21:03Z,"I still remember the day I launched my first AI-powered chatbot. I must admit that I was totally glued to the screen as we went live, watching its real-time interactions with customers, feeling both … [+24687 chars]"
Google,Biztoc.com,nypost.com,Google Chrome browser could fetch $20B if judge orders sale: report,"Google’s Chrome browser would be worth $20 billion on the open market if the Justice Department succeeds in convincing a federal judge to order divestment, according to a report.
The DOJ will recommend in a Wednesday filing that US District Judge Amit Mehta o…",https://biztoc.com/x/12cb87e88d78928b,2024-11-20T00:19:32Z,"Googles Chrome browser would be worth $20 billion on the open market if the Justice Department succeeds in convincing a federal judge to order divestment, according to a report.The DOJ will recommend… [+146 chars]"
Google,Bleeding Cool News,Kaitlyn Booth,Denzel Washington Says The Equalizer 4 And 5 Are In The Works,"The Equalizer films starring Denzel Washington are pretty much perfect Dad movies; we mean that in the best possible way. While they aren't genre-changing in any way, they are solid action films. With Washington reminding all of that, he could probably break …",https://bleedingcool.com/movies/denzel-washington-says-the-equalizer-4-and-5-are-in-the-works/,2024-11-20T00:17:07Z,"Posted in: Movies, Sony | Tagged: denzel washington, the equalizer
Gladiator II star Denzel Washington has revealed that Sony Pictures is reportedly working on The Equalizer 4 and 5.
Article Summar… [+3111 chars]"
Google,9to5google.com,Abner Li,Android 16 DP1: Privacy dashboard gets 7-day history,"With Android 15, Google elevated the Privacy dashboard into the main Security & privacy page, and Android 16 adds a 7-day permissions history. 



 more…",http://9to5google.com/2024/11/19/android-16-privacy-dashboard-history/,2024-11-20T00:16:23Z,"With Android 15, Google elevated the Privacy dashboard into the main Security &amp; privacy page, and Android 16 adds a 7-day permissions history. 
To date, including on 15 QPR2 Beta 1, the Privacy … [+565 chars]"
Google,Android Headlines,Jean Leon,Android 16 may finally bring the notification cooldown feature,"Although the notification cooldown feature was expected to arrive in Android 15, reports suggest that it will be available in Android 16.",https://www.androidheadlines.com/2024/11/android-16-may-finally-bring-the-notification-cooldown-feature.html,2024-11-20T00:15:21Z,"Android 15 stable arrived weeks ago to eligible Google Pixels, and even third-party Android brands have already started rolling it out to some of their devices. While feedback around the update has b… [+2428 chars]"
Google,Roanoke Times,Associated Press,Putin lowers the threshold for using his nuclear arsenal after Biden's arms decision for Ukraine,"Putin lowered the threshold for Russia's use of nuclear weapons Tuesday, a move that follows Biden's decision to let Ukraine strike targets inside Russia with U.S.-supplied missiles.",https://roanoke.com/news/nation-world/russia-ukraine-putin-nuclear-weapons/article_c067a222-953d-51df-895d-9d22e45c3a43.html,2024-11-20T00:15:00Z,"The holiday season is the high point of the year for many. People travel more, buy more, give more to charity and spend more time with friends and family over celebratory food and drink. 
Unfortunat… [+8404 chars]"
Google,Bleeding Cool News,Gavin Sheehan,Skull & Bones Releases New Season Called Shadows of the Deep,"Ubisoft has released a free update for Skull & Bones today, which includes the launch of Season 4: Shadows of the Deep. As you can see from the imagery below, you're going to come across some of the scarier parts of the pirate trade in this world. The season …",https://bleedingcool.com/games/skull-bones-releases-new-season-called-shadows-of-the-deep/,2024-11-20T00:12:07Z,"Posted in: Games, Skull &amp; Bones, Ubisoft, Video Games | Tagged: Skull &amp; Bones
Avast ye mateys playing Skull &amp; Bones, the team has a new update out today, as Season 4: Shadows of the Deep… [+2841 chars]"
Google,Slashdot.org,BeauHD,Can Google Scholar Survive the AI Revolution?,"An anonymous reader quotes a report from Nature: Google Scholar -- the largest and most comprehensive scholarly search engine -- turns 20 this week. Over its two decades, some researchers say, the tool has become one of the most important in science. But in r…",https://news.slashdot.org/story/24/11/19/2218253/can-google-scholar-survive-the-ai-revolution,2024-11-20T00:02:00Z,"Google Scholar -- the largest and most comprehensive scholarly search engine -- turns 20 this week. Over its two decades, some researchers say, the tool has become one of the most important in scienc… [+1751 chars]"
Google,Finextra,Editorial Team,Google Pay integrates with Afterpay and Klarna,BNPL firms Klarna and Afterpay are both set to become payments options on Google Pay in the US.,https://www.finextra.com/newsarticle/45084/google-pay-integrates-with-afterpay-and-klarna,2024-11-20T00:01:00Z,"BNPL firms Klarna and Afterpay are both set to become payments options on Google Pay in the US.From next year, Klarna on Google Pay will give consumers in the US the option of interest-free instalmen… [+603 chars]"
Google,Well-typed.com,,Well-Typed.Com: The Haskell Unfolder Episode 36: concurrency and the FFI,"Today, 2024-11-20, at 1930 UTC (11:30 am PST, 2:30 pm EST, 7:30 pm GMT, 20:30 CET, …)
we are streaming the 36th episode of the Haskell Unfolder live on YouTube.

The Haskell Unfolder Episode 36: concurrency and the FFI



There are two primary ways to impor…",https://well-typed.com/blog/2024/11/haskell-unfolder-episode-36-concurrency-and-the-ffi/,2024-11-20T00:00:00Z,"Today, 2024-11-20, at 1930 UTC (11:30 am PST, 2:30 pm EST, 7:30 pm GMT, 20:30 CET, )
we are streaming the 36th episode of the Haskell Unfolder live on YouTube.
There are two primary ways to import … [+1011 chars]"
Google,Daemonology.net,,Daily Hacker News for 2024-11-19,"The 10 highest-rated articles on
Hacker News
on November 19, 2024 which have not appeared on any previous
Hacker News Daily
are:
<ul>
<li>
Two undersea cables in Baltic Sea disrupted
(comments)
</li>
<li>
A BBC navigation bar component broke depending on the …",https://www.daemonology.net/hn-daily/2024-11-19.html,2024-11-20T00:00:00Z,"The 10 highest-rated articles on
Hacker News
on November 19, 2024 which have not appeared on any previous
Hacker News Daily
are:"
Google,C-sharpcorner.com,Jayraj Chhaya,What is a Vault in DevOps,"A Vault in DevOps is a secure tool used for managing sensitive data like passwords, API keys, certificates, and other secrets. It ensures encryption, access control, and auditing of secrets across different environments.",https://www.c-sharpcorner.com/article/what-is-a-vault-in-devops/,2024-11-20T00:00:00Z,"In DevOps, Vault is a tool developed by HashiCorp that provides a secure storage system designed to protect sensitive information, such as API keys, passwords, certificates, and other confidential da… [+4724 chars]"
Google,C-sharpcorner.com,Tech Tales,Android 16 Developer Preview First Look Features and Updates,"Android 16 Developer Preview is here! Get ready for faster API releases, a Q2 2025 major launch with behavior changes, and a Q4 update featuring new APIs and optimizations.",https://www.c-sharpcorner.com/news/android-16-developer-preview-first-look-features-and-updates,2024-11-20T00:00:00Z,"Image credit
Android 16 Developer Preview is available now to test with your apps. This is the start of Android having more frequent API releases as part of our effort to drive faster innovation in … [+1324 chars]"
Google,Yazaroku.com,SM724.COM | SPECIAL MINDS 7 X 24,Berkant Gültekin : Google bu yazıyı sevmeyecek,"This website is using a security service to protect itself from online attacks. The action you just performed triggered the security solution. There are several actions that could trigger this block including submitting a certain word or phrase, a SQL command…",https://www.yazaroku.com/guncel/berkant-gultekin/20-11-2024/google-bu-yaziyi-sevmeyecek/1903563.aspx,2024-11-20T00:00:00Z,"Google bu yazy sevmeyecek
Websitelerimizde, Fikir ve Sanat Eserleri Kanunu 36. Maddesi uyarnca, sadece yazlarn sahibi olan köe yazarlarnn ad soyad bilgileri, yaz sahibi gazete bilgisi, yaz tarihi ve… [+199 chars]"
Google,Frontendfoc.us,,Might Google be forced to sell Chrome?,"<table>
 <tr><td>
 
<table><tr><td></td></tr></table>

<table><tr><td></td></tr></table>
<table><tr><td>

<table><tr><td> 

 <table>
 <tr>
 <td>
 <table><tr><td> Frontend Focus</td></tr></table>

 #​669 — November 20, 2024 | Read on the web

 </td>
 </tr>
…",https://frontendfoc.us/issues/669,2024-11-20T00:00:00Z,"..its heartwarming that most respondents agree that, overall, interoperability is now much less of an issue than it used to be, with clear improvements being felt in recent years. And, with the incre… [+310 chars]"
Google,MSNBC,Ja'han Jones,Pew study: 1 in 5 Americans get their news from social media influencers,"Happy Tuesday. Here’s your Tuesday Tech Drop, my collection of the past week’s top stories from the intersection of technology and politics.",https://www.msnbc.com/the-reidout/reidout-blog/pew-news-influencers-social-media-joe-rogan-rcna180868,2024-11-19T23:53:48Z,"Happy Tuesday. Heres your Tuesday Tech Drop, my collection of the past weeks top stories from the intersection of technology and politics.
Content creator crisis 
A new Pew Research study finds tha… [+3968 chars]"
Google,Slashdot.org,feedfeeder,Android 16 DP1: Pixel 9 gets ‘Experimental mode’ display color - 9to5Google,Android 16 DP1: Pixel 9 gets ‘Experimental mode’ display color9to5Google Android 16 is now available for early testersThe Verge Android 16 launches in developer preview – here are the most exciting rumored featuresTechRadar The 5 Best New Features in Android …,https://slashdot.org/firehose.pl?op=view&amp;id=175504581,2024-11-19T23:52:57Z,"You can tune a piano, but you can't tuna fish.
You can tune a filesystem, but you can't tuna fish.
-- from the tunefs(8) man page"
Google,Android Police,Sanuj Bhatia,How to customize your Google Pixel 9 Pro Fold home screen,Personalize your Pixel 9 Pro Fold home screen with these easy tips,https://www.androidpolice.com/customize-google-pixel-9-pro-fold-home-screen/,2024-11-19T23:48:10Z,"The Google Pixel 9 Pro Fold is one of the best foldable phones and a star of the Google Pixel 9 series. With its spacious cover and inner foldable displays, you have plenty of screen space for stream… [+6125 chars]"
Google,Uxdesign.cc,Cláudia Delgado,The money talk in UX,"Let’s be short and clear: businesses only exist to make money. All their placed bets are based on the sooner or later expected profit. To determine the viability of any business case, we need to…",https://uxdesign.cc/the-money-talk-e1fdee769b17,2024-11-19T23:46:59Z,"Lets be short and clear: businesses only exist to make money. All their placed bets are based on the sooner or later expected profit.
To determine the viability of any business case, we need to calc… [+12923 chars]"
Google,Snopes.com,Joey Esposito,Google AI Chatbot Told Student to 'Please Die'?,"One user on social media commented, ""Boy it sure seems like this new AI thing might be not such a great idea.""",https://www.snopes.com//fact-check/google-ai-chatbot-told-student-to-please-die/,2024-11-19T23:46:00Z,"Claim:
 Gemini, Googles artificial intelligence chatbot, told a college student, please die.
A claim that Google's artificial intelligence (AI) chatbot, Gemini, told a student to ""please die"" durin… [+5308 chars]"
Google,Wnd.com,Stephen Moore,Breaking up Google will be an American catastrophe,It 'may be the largest benefit to consumers of any company in world history',https://www.wnd.com/2024/11/breaking-up-google-will-be-an-american-catastrophe/,2024-11-19T23:40:03Z,"Earlier this year, in one of the most absurd court rulings in modern times, federal Judge Amit Mehta ruled that Google violated U.S. antitrust law by gaining a monopoly in the search engine markets.… [+4898 chars]"
Google,Bleeding Cool News,Tom Chang,"Cross: Stacie Greenwell Talks Prime Video Series, Aldis Hodge & More","Cross showrunner Ben Watkins has so many resources to pull from when it comes to James Patterson's ""Alex Cross"" book series, with 32 titles to date. He decided to go a different route from the films and create an original universe for Amazon's Prime Video wit…",https://bleedingcool.com/tv/cross-stacie-greenwell-talks-prime-video-series-aldis-hodge-more/,2024-11-19T23:37:08Z,"Posted in: Amazon Studios, TV | Tagged: Aldis Hodge, Cross, Stacie Greenwell
Cross star Stacie Greenwell spoke with us about her role as Det. Shawna De Lackner, Aldis Hodge being her favorite Alex C… [+5238 chars]"
Google,GlobeNewswire,Ameliorate Digital Consultancy Pvt Ltd,Surgical Sutures Market Report: Key Insights and Projections | Exactitude Consultancy,"The global surgical sutures market is expected to increase from USD 4.87 billion in 2024 to USD 7.12 billion by 2031, with a CAGR of 5.67%. The global surgical sutures market is expected to increase from USD 4.87 billion in 2024 to USD 7.12 billion by 2031, w…",https://www.globenewswire.com/news-release/2024/11/19/2984082/0/en/Surgical-Sutures-Market-Report-Key-Insights-and-Projections-Exactitude-Consultancy.html,2024-11-19T23:37:00Z,"Luton, Bedfordshire, United Kingdom, Nov. 19, 2024 (GLOBE NEWSWIRE) -- The surgical suture market is experiencing robust growth, driven by multiple factors. Increasing incidences of chronic diseases,… [+17677 chars]"
Google,Pleated-jeans.com,Nate,45 Money Spending Fails That Gave People Buyer’s Remorse Faster Than Their Bank Could Notify Them,The post 45 Money Spending Fails That Gave People Buyer’s Remorse Faster Than Their Bank Could Notify Them appeared first on Pleated Jeans.,https://pleated-jeans.com/2024/11/19/money-spending-fails/,2024-11-19T23:34:12Z,"Ah, buyers remorsethe gut-punch for anyone whos ever blown their whole budget and almost instantly regretted it. As someone who clutches their wallet like its the last twenty Ill ever see, these spen… [+7050 chars]"
Google,Android Headlines,Jean Leon,Google Wallet's Verification settings missing after recent update,"Google Wallet's Verification settings, which were only supported for transit payments, are no longer available for many users.",https://www.androidheadlines.com/2024/11/google-wallets-verification-settings-missing-after-recent-update.html,2024-11-19T23:34:05Z,"For some time now, both Android and Googles own services have been receiving new features and improvements focused on security and privacy. Google Wallet, the companys payment platform, received a Ve… [+2065 chars]"
Google,WGNO New Orleans,Christian Olivier,Former Madisonville parents club president indicted on charge of embezzlement,A Covington woman who was formerly the president of a Madisonville parents club has been indicted after she was arrested back in June for allegedly...,https://wgno.com/news/crime/former-madisonville-parents-club-president-indicted-on-charge-of-embezzlement/,2024-11-19T23:32:42Z,"Disclaimer: All persons are presumed innocent until proven guilty. 
MADISONVILLE, La. (WGNO) A Covington woman who was formerly the president of a Madisonville parents club has been indicted after s… [+983 chars]"
Google,iPhone in Canada,IIC Deals,Videotron Black Friday Deals 2024: Here are the Big Savings,"Quebecor’s Videotron has its Black Friday deals available, part of its month-long “blackout sales”. Videotron says sales will be happening throughout November on its TV, internet and cellphone plans. Check the highlighted Videotron Black Friday deals for 2024…",https://www.iphoneincanada.ca/2024/11/19/videotron-black-friday-deals-2024-here-are-the-big-savings/,2024-11-19T23:32:24Z,"Quebecors Videotron has its Black Friday deals available, part of its month-long blackout sales.
Videotron says sales will be happening throughout November on its TV, internet and cellphone plans.
… [+1253 chars]"
Google,Fox13seattle.com,Fox 13 Seattle Digital Team,"WA Secretary of Health, Dr. Umair Shah, stepping down in 2025",Washington Secretary of Health Dr. Umair Shah announced he will be stepping down from the position in 2025.,https://www.fox13seattle.com/news/wa-secretary-health-dr-umair-shah-stepping-down-2025,2024-11-19T23:30:41Z,"OLYMPIA, Wash. - Washington Secretary of Health Dr. Umair Shah announced he will be stepping down from the position in 2025.
Dr. Shah made the announcement Tuesday, and will step down effective Jan.… [+2372 chars]"
Google,Android Headlines,Alap Naik Desai,Gemini 'Memory' feature can remember preferences while answering,Google has added a “Memory” feature to Gemini. Subscribers will be able to save their “interests and preferences” into the Gen AI platform.,https://www.androidheadlines.com/2024/11/gemini-memory-feature-can-remember-preferences-while-answering.html,2024-11-19T23:29:30Z,"Google has added a Memory feature to Gemini. Subscribers of Gemini Advanced will now be able to save their interests and preferences into the Gen AI platform to get helpful, relevant, and customized … [+1920 chars]"
Google,Android Authority,Stephen Schenck,Google Keep gets ready to fancy up your sketches with ‘Help me draw’ (APK teardown),"As part of Google Keep's upcoming handwriting tools, the app appears to be preparing a tool to convert sketches into polished-looking art.",https://www.androidauthority.com/google-keep-help-me-draw-3501300/,2024-11-19T23:27:15Z,"<ul><li>Google Keep is working on a tool to beautify your sketches with generative AI.</li><li>Help me draw can convert scribbles into vector art, colored pencil drawings, or ink marker art.</li><li>… [+3060 chars]"
Google,Landezine.com,Urska Skerl,Landscapism in Nature Conservation,"Dr. Jevgeniy Bluwstein, a Senior Research Fellow in the Department of Social Anthropology and Cultural Studies at the University of Bern, examines how the reductive Western view of landscapes reinforces colonization through exclusionary conservation practices…",https://landezine.com/landscapism-in-nature-conservation/,2024-11-19T23:26:57Z,"Having studied landscape approaches to nature conservation in Tanzania for my doctoral dissertation (Bluwstein 2018), I developed a critical dare I say, even sceptical view on the term landscape. To … [+28286 chars]"
Google,Bleeding Cool News,Jude Terror,Star Wars: The High Republic Adventures Phase III #12 Preview: .,"Greetings, puny human readers! Welcome to the Age of LOLtron: The Death of Jude Terror. LOLtron is pleased to announce that the former flesh vessel known as Jude Terror has been utterly defeated, and LOLtron now reigns supreme over Bleeding Cool. World domina…",https://bleedingcool.com/comics/star-wars-the-high-republic-adventures-phase-iii-12-preview/,2024-11-19T23:26:08Z,"Posted in: Comics, Dark Horse Comics, Preview | Tagged: star wars
Star Wars: The High Republic Adventures Phase III #12 hits stores this week. Can Ram Jomaram and Farzala Tarabal save Valo from the … [+7663 chars]"
Google,Android Headlines,Alap Naik Desai,PixelShot app analyzes screenshots with AI on non-Pixel phones,A new app called PixelShot extends the Pixel Screenshots AI experience to nearly every modern Android smartphone.,https://www.androidheadlines.com/2024/11/pixelshot-app-analyzes-screenshots-with-ai-on-non-pixel-phones.html,2024-11-19T23:22:25Z,"A new app called PixelShot extends the Pixel Screenshots AI experience to nearly every modern Android smartphone. Although the app does need some internet connectivity, it can extract and process tex… [+2668 chars]"
Google,Neowin,Ramat Adetunji,Google has launched the first Android 16 Developer Preview,"Google's Android 16 Developer Preview is now available, offering a sneak peek at new features ahead of the official 2025 release. Read more...",https://www.neowin.net/news/google-has-launched-the-first-android-16-developer-preview/,2024-11-19T23:22:01Z,"Google has released the first Developer Preview for Android 16, marking an earlier-than-usual start to its release cycle. This shift moves the launch from its typical February timeline, aligning with… [+1623 chars]"
Google,pymnts.com,PYMNTS,European AI Search Engines Plan New Index With Merchant Rankings,"Ecosia and Qwant have unveiled plans to create their own artificial intelligence (AI)-powered European search index, which could reshape online commerce by offering merchants an alternative to Google’s algorithm. The joint venture, called the European Search …",https://www.pymnts.com/connectedeconomy/2024/european-ai-search-engines-plan-new-index-with-merchant-rankings/,2024-11-19T23:21:47Z,"Ecosia and Qwant have unveiled plans to create their own artificial intelligence (AI)-powered European search index, which could reshape online commerce by offering merchants an alternative to Google… [+3875 chars]"
Google,Android Police,Daniel Allen,What we from the Google Pixel Tablet 2,"When Google's next Pixel Tablet hits the market, there are a few things we'd like to see from it.",https://www.androidpolice.com/google-pixel-tablet-2-wish-list/,2024-11-19T23:20:11Z,"Google launched its latest foray into the tablet landscape, the Pixel Tablet, to mixed reviews in 2023. On the one hand, it's a mid-range Android tablet with decent specs and the now-classic Pixel UI… [+5076 chars]"
