company,source,author,title,description,url,published_at,content
Apple,[Removed],,[Removed],[Removed],https://removed.com,2024-11-20T02:58:16Z,[Removed]
Apple,Crypto Briefing,Vivian Nguyen,Michael Saylor to present Bitcoin investment strategy to Microsoft’s board,"Microsoft's consideration of Bitcoin investment could influence other major corporations to reevaluate their cash management strategies.
The post Michael Saylor to present Bitcoin investment strategy to Microsoft’s board appeared first on Crypto Briefing.",https://cryptobriefing.com/michael-saylor-bitcoin-investment-microsoft/,2024-11-20T02:50:41Z,"Key Takeaways
<ul><li>Michael Saylor will present a Bitcoin investment strategy to Microsoft's board.</li><li>The board previously argued that Microsoft already evaluates various assets, including B… [+1965 chars]"
Apple,TechRadar,Max Langridge,Xgimi Aura 2 review: a fantastic ultra short-throw projector with one major flaw,"The Xgimi Aura 2 is an excellent ultra-short throw projector, delivering vibrant, detailed images. It's built-in speaker system is also a force to be reckoned with.",https://www.techradar.com/televisions/projectors/xgimi-aura-2-review,2024-11-20T02:48:48Z,"Xgimi Aura 2: two-minute review
The Xgimi Aura 2 is a premium ultra short-throw (UST) 4K projector to come from the Chinese brand and is an update to 2021’s Aura. Like its predecessor, the Aura 2 ai… [+18133 chars]"
Apple,TechSpot,Daniel Sims,"Microsoft Teams previews real-time translation for conference calls, coming next year","One of the many Copilot ""AI agents"" coming soon to Microsoft 365 aims to translate speakers' voices during meetings in Microsoft Teams. The functionality will enter public preview in early 2025.Read Entire Article",https://www.techspot.com/news/105640-microsoft-teams-previews-real-time-translation-conference-calls.html,2024-11-20T02:48:00Z,"Forward-looking: Real-time translation is often cited as one of the most practical applications of generative AI, and Microsoft plans to bring this feature to its video conferencing and team collabor… [+2797 chars]"
Apple,The Times of India,Reuters,Qualcomm 'positive' on Trump administration as it forecasts chip sales growth,"Qualcomm executives made the remarks at an investor event in New York during which the company forecast $22 billion in combined revenue over the next five years from laptops, cars and other products outside its current stronghold in smartphones, a sharp growt…",https://economictimes.indiatimes.com/tech/technology/qualcomm-positive-on-trump-administration-as-it-forecasts-chip-sales-growth/articleshow/115469346.cms,2024-11-20T02:47:29Z,"Qualcomm said on Tuesday it was ""positive"" on President-elect Donald Trump's incoming administration and not concerned that proposed US tariffs on China would dampen its business in the country from … [+4070 chars]"
Apple,Applech2.com,applech2,"Anker Japan、USB-CケーブルとApple Watch用ワイヤレス充電器を一体化したモバイルバッテリー「Anker MagGo Power Bank (10000mAh, 35W, For Apple Watch)」にブラックとピンク、ミントブルーカラーを追加。","Anker JapanがUSB-CケーブルとApple Watch用ワイヤレス充電器を一体化したモバイルバッテリー「Anker MagGo Power Bank (10000mAh, 35W, For Apple Wa […]
The post Anker Japan、USB-CケーブルとApple Watch用ワイヤレス充電器を一体化したモバイルバッテリー「Anker MagGo Power Bank (10000mAh, 35W, For Apple Watch)」にブラックとピンク、ミントブルーカラーを追加…",https://applech2.com/archives/20241120-anker-japan-maggo-power-bank-10k-35w-for-apple-watch-new-colors.html,2024-11-20T02:45:01Z,"Anker JapanUSB-CApple WatchAnker MagGo Power Bank (10000mAh, 35W, For Apple Watch)
Anker Japan202409USB-CApple Watch3-in-1Anker MagGo Power Bank (10000mAh, 35W, For Apple Watch) (A1657)
Anker MagGo… [+166 chars]"
Apple,Android Authority,Edgar Cervantes,Sale: Samsung and Apple wireless chargers under $20!,"If you're looking for a wireless charger, we have two great deals for you. These Samsung and Apple units are on sale, but not for long!",https://www.androidauthority.com/samsung-15w-duo-pad-apple-magsafe-wireless-charger-deals-3501337/,2024-11-20T02:39:29Z,"Both of these offers come from Woot!, an Amazon-owned website focusing on deals. The Samsung offer ends in a day and has a limit of two units per customer. The Apple charger discount ends in three da… [+2222 chars]"
Apple,Fox News,Lindsay Kornick,Trump supporters use pregnant man emoji to defend RFK from 'anti-science' liberal attacks,"Elon Musk resurfaced the controversial pregnant man emoji on Apple iPhones on X Saturday to call out left-wing critics of Robert F. Kennedy as “anti-science.""",https://www.foxnews.com/media/trump-supporters-use-pregnant-man-emoji-defend-rfk-from-anti-science-liberal-attacks,2024-11-20T02:30:41Z,"SpaceX CEO Elon Musk mocked left-wing critics claiming President-elect Donald Trump's pick to lead the Department of Health and Human Services (HHS), Robert F. Kennedy, is ""anti-science"" by using the… [+2346 chars]"
Apple,Independent.ie,Deirdre Rooney,When the apple falls far from the tree: How to raise a child who is completely different to you,"Every parent dreams of having a ‘mini-me’, a child with whom they can share their loves and interests.",https://www.independent.ie/life/family/parenting/when-the-apple-falls-far-from-the-tree-how-to-raise-a-child-who-is-completely-different-to-you/a87919917.html,2024-11-20T02:30:00Z,"Every parent dreams of having a mini-me, a child with whom they can share their loves and interests.
Maybe its kicking about a football on a weekend, or playing the violin together, or even travelli… [+27 chars]"
Apple,Digital Journal,AFP,Hong Kong tycoon Jimmy Lai takes witness stand in collusion trial,"Pro-democracy Hong Kong tycoon Jimmy Lai will take the stand in his collusion trial on Wednesday, testifying in court for the first time despite five previous trials in almost four years. Lai’s case is one of the most prominent prosecuted under the national s…",https://www.digitaljournal.com/world/hong-kong-tycoon-jimmy-lai-takes-witness-stand-in-collusion-trial-2/article,2024-11-20T02:28:14Z,"Pro-democracy Hong Kong tycoon Jimmy Lai will on Wednesday take the stand in his collusion trial - Copyright AFP AHMAD AL-RUBAYE
Pro-democracy Hong Kong tycoon Jimmy Lai will take the stand in his c… [+4015 chars]"
Apple,CinemaBlend,Maggie Sheck,'Scared' Jon Hamm Had Two Words Of Advice For Himself Before Going Live From New York On SNL,Hamm opens up about those last moments before it's showtime at Studio 8H.,https://www.cinemablend.com/television/jon-hamm-two-words-of-advice-for-himself-before-snl,2024-11-20T02:27:31Z,"Jon Hamm is no stranger to Saturday Night Live, and although he’s only a member of the ""thrice-timers club,"" (his words), he’s shown up plenty over the years for special cameos. Beyond the late-night… [+2796 chars]"
Apple,Biztoc.com,asia.nikkei.com,Hong Kong media mogul Jimmy Lai's trial resumes 4 years after arrest,"HONG KONG -- A Hong Kong court on Wednesday resumed proceedings in the trial against pro-democracy media mogul Jimmy Lai Chee-ying, one day after 45 activists were sentenced in the city's biggest national security case.
Lai, the founder of the now-defunct ind…",https://biztoc.com/x/84e840bcec057135,2024-11-20T02:21:04Z,"HONG KONG -- A Hong Kong court on Wednesday resumed proceedings in the trial against pro-democracy media mogul Jimmy Lai Chee-ying, one day after 45 activists were sentenced in the city's biggest nat… [+153 chars]"
Apple,Newsweek,Zach Pressnell,This Mets-White Sox Trade Sends $3 Million Ace To Big Apple For Top Prospects,The New York Mets are one of the top teams in the Garrett Crochet trade sweepstakes and they could move a package of prospects to acquire the $3 million ace.,https://www.newsweek.com/sports/mlb/this-mets-white-sox-trade-sends-3-million-ace-big-apple-top-prospects-1988662,2024-11-20T02:12:21Z,ESPN's Jesse Rogers recently did a poll of 18 MLB executives and insiders where he asked a plethora of different questions. One of those questions asked where Chicago White Sox ace Garrett Crochet wo… [+2384 chars]
Apple,Digital Journal,Markos Papadatos,Will Brittain talks about starring in the film ‘Samson’,"Actor Will Brittain chatted about starring in the film ""Samson,"" which will be released via Freestyle Digital Media.
The post Will Brittain talks about starring in the film ‘Samson’ appeared first on Digital Journal.",https://www.digitaljournal.com/entertainment/will-brittain-talks-about-starring-in-the-film-samson/article,2024-11-20T02:06:59Z,"Will Brittain in 'Samson.' Photo Courtesy of Freestyle Digital Media.
Actor Will Brittain chatted about starring in the film “Samson,” which will be released via Freestyle Digital Media.
Aside from… [+1667 chars]"
Apple,9to5Mac,Filipe Espósito,Developers behind F1 app ‘Lapz’ for Vision Pro forced to remove it from TestFlight,"Compared to the iPhone and iPad, Apple Vision Pro has a limited number of apps available in the App Store. Even so, developers have been exploring the device’s capabilities with different projects, one of which is the Formula 1 app “Lapz.” Unfortunately, the …",https://9to5mac.com/2024/11/19/f1-app-lapz-vision-pro-testflight/,2024-11-20T02:04:05Z,"Compared to the iPhone and iPad, Apple Vision Pro has a limited number of apps available in the App Store. Even so, developers have been exploring the device’s capabilities with different projects, o… [+1795 chars]"
Apple,BBC News,,"No plans to join Bluesky yet, Keir Starmer says",The social media platform has been rapidly growing in popularity since the US presidential election.,https://www.bbc.com/news/articles/cwy12ny01e1o,2024-11-20T02:03:41Z,"Sir Keir Starmer has said he has ""no plans"" to join the Bluesky social media platform.
There has been a rising wave of popularity for the app - an alternative to Elon Musk's X - in recent weeks.
Bl… [+1682 chars]"
Apple,Slickdeals.net,ehiker,Micro Center Stores: Apple AirPods 4 Active Noise Cancelling Wireless Earbuds $150 + Free Store Pickup (Select Locations),"Today Microcenter have Apple AirPods 4 with noise cancelation on sale for $149.99!

Not sure for how long. Sadly no shipping but store pickup is allowed.

Link:
https://www.microcenter.com/produ...bud",https://slickdeals.net/f/17900991-micro-center-stores-apple-airpods-4-active-noise-cancelling-wireless-earbuds-150-free-store-pickup-select-locations?utm_source=rss&utm_content=fp&utm_medium=RSS2,2024-11-20T02:02:09Z,I love the feeling of non-pro AirPods and am sensitive to silicone tips so I was psyched that they released a hard-tip model with most of the pro features. My review: it's just ok. The ANC-related fe… [+913 chars]
Apple,Paul Tan's Automotive News,Gerard Lye,"2025 Kia Sportage open for booking in Malaysia – 1.6T, 7DCT or 2.0L NA, 6AT; active safety; debut at KLIMS","Dinamikjaya Motors, the official distributor of Kia vehicles in Malaysia, has officially announced the start of order taking for the Kia Sportage. It has been a long wait for the C-segment SUV, and as previously […]
The post 2025 Kia Sportage open for booking…",https://paultan.org/2024/11/20/2025-kia-sportage-open-for-booking-in-malaysia-1-6t-7dct-or-2-0l-na-6at-active-safety-debut-at-klims/,2024-11-20T02:00:43Z,"Dinamikjaya Motors, the official distributor of Kia vehicles in Malaysia, has officially announced the start of order taking for the Kia Sportage. It has been a long wait for the C-segment SUV, and a… [+2497 chars]"
Apple,Substack.com,Matt Labash,"LABASH: GO AHEAD, PUT ME ON THE 'ENEMIES LIST'...","LABASH: GO AHEAD, PUT ME ON THE 'ENEMIES LIST'...

 
 
 
 (Second column, 11th story, link)

 

 

 
 Related stories:REICH: To protect democracy from tyrants, we must protect the truly free press...
Will Courts Put End to Confidential Sources?",https://mattlabash.substack.com/p/if-youre-an-authoritarian-peckerhead,2024-11-20T01:58:36Z,"Editors Note: Have a question about whether Matt, if tapped to serve in Trumps cabinet, will say yes?  He wont. His conscience, such as it is, forbids it. Unless he was put in charge of fisheries as … [+9856 chars]"
Apple,Gamediscover.co,Simon Carless,Tiny Glade 'built' its way to >600k sold in a month,"Also: a whole heap of game discovery & platform news, & some bonus radical politics.",https://newsletter.gamediscover.co/p/how-tiny-glade-built-its-way-to-600k,2024-11-20T01:45:13Z,"[The GameDiscoverCo game discovery newsletter is written by how people find your game expert &amp; company founder Simon Carless, and is a regular look at how people discover and buy video games in t… [+13875 chars]"
Apple,The Denver Post,BestReviews,Early Black Friday deals are live — don’t miss out,"Black Friday deals are already here, and there's lots of savings to be had! Check out these deals we found so you can make the most of the sales.",https://www.denverpost.com/2024/11/19/early-black-friday-deals-are-live-dont-miss-out-2/,2024-11-20T01:37:55Z,"There’s something for everyone with these can’t-miss deals
For seasoned shoppers, Black Friday is a holiday in its own right. Whether you’re ready to start ticking names off your holiday shopping li… [+7687 chars]"
Apple,Hacker News,m3047,Show HN: A kind of looking glass for web abuse,"It kind of occurs to me that maybe this would be generally useful to people with exposed web servers, so I've made it generally available at least for the moment. You should be able to hit it as often as once per hour without getting banned.It would be better…",https://news.ycombinator.com/item?id=42189998,2024-11-20T01:36:12Z,"It kind of occurs to me that maybe this would be generally useful to people with exposed web servers, so I've made it generally available at least for the moment. You should be able to hit it as ofte… [+1492 chars]"
Apple,Android Police,Nathaniel Wilkins,6 critical threats to your phone and how to protect your device against them,"From malware and viruses to dropping your phone in the toilet, your device and your data are always at risk. Find out how to protect them",https://www.androidpolice.com/6-critical-threats-to-your-phone-protection/,2024-11-20T01:35:10Z,"You're at the airport, connected to public Wi-Fi, not knowing you're on an impostor network designed to steal from you. Then, you drop your phone and crack the screen or lose it. From dangerous netwo… [+6254 chars]"
Apple,seattlepi.com,"By KANIS LEUNG, Associated Press",Former Hong Kong publisher Jimmy Lai is expected to testify in his national security trial soon,"The landmark national security trial of prominent Hong Kong activist publisher Jimmy Lai resumes Wednesday, with the founder of the now-shuttered pro-democracy newspaper Apple Daily expected to testify in his defense soon. Lai was arrested in 2020 during a cr…",https://www.seattlepi.com/news/world/article/former-hong-kong-publisher-jimmy-lai-is-expected-19930420.php,2024-11-20T01:30:30Z,"HONG KONG (AP) The landmark national security trial of prominent Hong Kong activist publisher Jimmy Lai resumes Wednesday, with the founder of the now-shuttered pro-democracy newspaper Apple Daily ex… [+3824 chars]"
Apple,LADbible,Chennon Kyle Santaren,Save almost $400 on a range of Apple iPhones during Amazon's Black Friday sale,"Ready to upgrade? Check out Amazon’s top deals on iPhone 12, 14, 15, and 15 Pro Max this Black Friday.",https://www.ladbible.com/news/best-iphone-deals-amazon-black-friday-313728-20241119,2024-11-20T01:28:55Z,"This article contains affiliate links and LADbible Group might make a commission on anything purchased.
Black Friday is running full steam, and if youve been eyeing an Apple iPhone, nows the perfect… [+1160 chars]"
Apple,CNA,,Hong Kong tycoon Jimmy Lai to take witness stand in collusion trial,"HONG KONG: Pro-democracy Hong Kong tycoon Jimmy Lai will on Wednesday (Nov 20) take the stand in his collusion trial, testifying in court for the first time despite five previous trials in alm",https://www.channelnewsasia.com/east-asia/jimmy-lai-hong-kong-tycoon-democracy-witness-stand-trial-4758571,2024-11-20T01:28:12Z,"""MEDIA BUSINESS AS PLATFORM""
Lai faces one count of ""conspiracy to publish seditious publications"" as well as two counts of conspiracy to foreign collusion.
The case against him revolves around 161… [+2196 chars]"
Apple,The Mac Observer,Jose Luansing Jr.,Shop the Best Early Black Friday Deals for Apple in 2024,"Apple products have long been the gold standard for tech, but they’re also infamous for their steep price tags. Jokes about paying a premium for the Apple logo are everywhere. While some argue you can get “the same” with other brands, the truth is that nothin…",https://www.macobserver.com/tips/round-ups/best-early-black-friday-deals-apple/,2024-11-20T01:26:44Z,"Apple products have long been the gold standard for tech, but theyre also infamous for their steep price tags. Jokes about paying a premium for the Apple logo are everywhere. While some argue you can… [+4356 chars]"
Apple,ABC News,KANIS LEUNG Associated Press,Former Hong Kong publisher Jimmy Lai is expected to testify in his national security trial soon,"The landmark national security trial of prominent Hong Kong activist publisher Jimmy Lai resumes Wednesday, with the founder of the now-shuttered pro-democracy newspaper Apple Daily expected to testify in his defense soon",https://abcnews.go.com/Business/wireStory/former-hong-kong-publisher-jimmy-lai-expected-testify-116030921,2024-11-20T01:26:28Z,"HONG KONG -- The landmark national security trial of prominent Hong Kong activist publisher Jimmy Lai resumes Wednesday, with the founder of the now-shuttered pro-democracy newspaper Apple Daily expe… [+3587 chars]"
Apple,ABC News,KANIS LEUNG Associated Press,Former Hong Kong publisher Jimmy Lai is expected to testify in his national security trial soon,"The landmark national security trial of prominent Hong Kong activist publisher Jimmy Lai resumes Wednesday, with the founder of the now-shuttered pro-democracy newspaper Apple Daily expected to testify in his defense soon",https://abcnews.go.com/International/wireStory/former-hong-kong-publisher-jimmy-lai-expected-testify-116030920,2024-11-20T01:26:27Z,HONG KONG -- Former Hong Kong publisher Jimmy Lai began testifying Wednesday in his landmark national security trial that is widely seen as a measure of press freedom and judicial independence in the… [+4069 chars]
Apple,Ozbargain.com.au,ArtisanStraps,15% off Ready-to-Wear Leather Watch Straps + Free Delivery ($0 with $100 Pre-Discount Order) @ Artisan Straps,"Hi Oz Bargain

I'm Jayson and I'm a leathercrafter specialising in making watch straps here in Sydney, Australia.

We are offering 15% OFF our Ready-to-Wear Straps as part of our Black Friday Sale until the end of November.

The leather straps are made in Aus…",https://www.ozbargain.com.au/node/878278,2024-11-20T01:17:07Z,"Hi Oz Bargain
I'm Jayson and I'm a leathercrafter specialising in making watch straps here in Sydney, Australia.
We are offering 15% OFF our Ready-to-Wear Straps as part of our Black Friday Sale un… [+285 chars]"
Apple,Biztoc.com,abcnews.go.com,Former Hong Kong publisher Jimmy Lai is expected to testify in his national security trial soon,"The landmark national security trial of prominent Hong Kong activist publisher Jimmy Lai resumes Wednesday, with the founder of the now-shuttered pro-democracy newspaper Apple Daily expected to testify in his defense soon",https://biztoc.com/x/bad0bc2518a93f76,2024-11-20T01:14:45Z,"The landmark national security trial of prominent Hong Kong activist publisher Jimmy Lai resumes Wednesday, with the founder of the now-shuttered pro-democracy newspaper Apple Daily expected to testi… [+82 chars]"
Apple,Techreport.com,Rida Fatima,Gemini Crypto Exchange Receives VASP License to Operate in France,"Gemini crypto exchange, founded by the Winklevoss twins, secures VASP license to operate in France.
The exchange acknowledges France as formidable with proactive engagement and support for the digital asset sector.
The expansion marks part of the company’s vi…",https://techreport.com/crypto-news/gemini-crypto-exchange-receives-vasp-license-to-operate-in-france/,2024-11-20T01:09:58Z,"Key takeaways
<ul><li>Gemini crypto exchange, founded by the Winklevoss twins, secures VASP license to operate in France.</li><li>The exchange acknowledges France as formidable with proactive engage… [+3676 chars]"
Apple,Financial Post,The Associated Press,Former Hong Kong publisher Jimmy Lai begins to testify in his national security trial,HONG KONG (AP) — Former Hong Kong publisher Jimmy Lai began testifying Wednesday in his landmark national security trial that is widely seen as a measure of press freedom and judicial independence in the Asian financial hub. Lai entered the court in a grey bl…,https://financialpost.com/pmn/former-hong-kong-publisher-jimmy-lai-is-expected-to-testify-in-his-national-security-trial-soon,2024-11-20T01:05:32Z,"Author of the article:
Article content
HONG KONG (AP) Former Hong Kong publisher Jimmy Lai began testifying Wednesday in his landmark national security trial that is widely seen as a measure of pre… [+6889 chars]"
Apple,Medium,Dilan the techie,10 Reasons to Upgrade to the New M4 Mac Mini,"The M4 Mac Mini is finally here, and Apple has raised the bar once again with its latest offering. Whether you’re a tech enthusiast, a professional needing top-tier performance, or just looking for…",https://medium.com/adventures-in-consumer-technology/10-reasons-to-upgrade-to-the-new-m4-mac-mini-3d8e2f6d68f0,2024-11-20T01:04:53Z,"Absolutely! The M4 Mac Mini is a remarkable upgrade for anyone, whether youre using an older Mac Mini or considering switching from another platform. Its blend of performance, portability, and price … [+313 chars]"
Apple,NerdWallet,Tommy Tindall,"Best Black Friday Deals: When to Shop, What to Buy and What to Skip","Look now for the best Black Friday deals on TVs, music gear and even major appliances. Wait out the week to buy clothes, shoes and small appliances.",https://www.nerdwallet.com/article/finance/best-black-friday-deals#article,2024-11-20T01:04:28Z,"It feels like its been Black Friday for weeks already, but the best deals on popular products are likely still to come. The official Black Friday is Nov. 29, the day after Thanksgiving, and some big … [+6680 chars]"
Apple,[Removed],,[Removed],[Removed],https://removed.com,2024-11-20T01:03:13Z,[Removed]
Apple,Hkcert.org,,Apple Products Multiple Vulnerabilities,"Multiple vulnerabilities were identified in Apple Products. A remote attacker could exploit some of these vulnerabilities to trigger remote code execution and cross-site scripting on the targeted system.

 

Note:

CVE-2024-44308 and CVE-2024-44309 are active…",https://www.hkcert.org/security-bulletin/apple-products-multiple-vulnerabilities_20241120,2024-11-20T01:00:00Z,Multiple vulnerabilities were identified in Apple Products. A remote attacker could exploit some of these vulnerabilities to trigger remote code execution and cross-site scripting on the targeted sys… [+244 chars]
Apple,Forbes,"Natasha Gural, Contributor, 
 Natasha Gural, Contributor
 https://www.forbes.com/sites/natashagural/","Magritte Masterpiece Fetches $121 Million At Christie’s New York, Setting New Auction Record For Surrealist Master","Darkened trees pierce into white cumulus clouds lingering in a pastel-blue sky, as we gaze intently at a street scene oscillating between day and night.",https://www.forbes.com/sites/natashagural/2024/11/19/magritte-masterpiece-fetches-121-million-at-christies-new-york-setting-new-auction-record-for-surrealist-master/,2024-11-20T00:59:37Z,"RENE MAGRITTE (1898-1967) L'empire des lumières signed 'Magritte' (lower right); signed again, dated ... [+] and titled '""L'Empire des Lumières"" Magritte 1954' (on the reverse) oil on canvas 57 ½ x 4… [+2629 chars]"
Apple,Daringfireball.net,John Gruber,Dr. Oz,I met Dr. Oz ten years ago.,https://daringfireball.net/2024/11/dr_oz,2024-11-20T00:54:51Z,"The Hollywood Reporter, which of course is where one now goes to find news of incoming Executive Branch appointments and nominations, Trump Nominates Dr. Mehmet Oz to Run Centers for Medicare and Med… [+3906 chars]"
Apple,Android Headlines,Kristijan Lucic,Phone Comparisons: Apple iPhone 16 Pro vs Apple iPhone 16,"If you're trying to choose between Apple's two compact phones, here's the Apple iPhone 16 Pro vs Apple iPhone 16 comparison.",https://www.androidheadlines.com/phone-comparisons-apple-iphone-16-pro-vs-apple-iphone-16,2024-11-20T00:54:14Z,"In this article, well be comparing two of the newest compact smartphones Apple has to offer. Itll be a comparison between the Apple iPhone 16 Pro vs Apple iPhone 16. Many people are saying that the i… [+9603 chars]"
Apple,Newsweek,Zach Pressnell,Mets Listed As Top Trade Destination For $3 Million White Sox Ace,A panel of MLB executives and insiders listed the New York Mets as the top trade destination for Chicago White Sox ace Garrett Crochet.,https://www.newsweek.com/sports/mlb/mets-listed-top-trade-destination-3-million-white-sox-ace-1988650,2024-11-20T00:53:46Z,The Chicago White Sox are expected to trade their ace Garrett Crochet before the 2025 season gets underway. He's at his highest trade value this offseason and the White Sox likely won't be able to ex… [+1626 chars]
